LOC,VEH_SER_NO,INSP_COMT,TS_LOAD,FOUND_INSP_TEAM,RESP_INSP_TEAM,RESP_INSP_OPRUNT
17,LEA891,Bpede bet ba bnec ba bnam beget bpede bin ba.,8-Mar-17,629,,
17,IFP328,Bamet beu ba blitora bper ba ba benim.,8-Mar-17,607,,
17,YHB831,Bdiam bat.,8-Mar-17,517,,
17,TFX540,Belit bad.,8-Mar-17,413,,
17,YHB831,Bdiam bat beu bmi.,8-Mar-17,517,,
17,GQV369,Bnibh bet ba beni ba blectus.,8-Mar-17,409,,
17,YHB831,Bquis but bcubilia ba btempor bac.,8-Mar-17,517,,
17,QMA357,Beget bac ba ba ba belit ba bhac bat bpharetra ba bhac ba ba bmi.,8-Mar-17,409,,
17,QMA357,Bpede bac.,8-Mar-17,409,,
17,WTB963,Bpede bmi ba bcurae beros bid bad ba ba bpotenti bcum.,8-Mar-17,517,,
17,LTV094,Bante bet ba.,8-Mar-17,409,,
17,WQB451,Bpede bat ba.,8-Mar-17,209,,
17,ERC382,Bduis bad bve belit ba ba bvelit ba ba bnec.,8-Mar-17,409,,
17,GFM783,Burna bve ba.,8-Mar-17,507,,
17,GFM783,Bdiam bve bat bhac bac ba bornare bdui beni.,8-Mar-17,507,,
17,QDR380,Berat bad ba ba beu beros benim bdictum bmus.,8-Mar-17,513,273,200
17,WTB963,Bquis bmi bid ba bsem bsemper beni bvelit binteger.,8-Mar-17,517,,
17,LNW546,Bquam bet ba bplatea bmattis ba bamet ba ba.,8-Mar-17,107,,
17,RHX208,Bcras bid ba beni bviverra but ba.,8-Mar-17,409,,
17,QDR380,Bnibh bid.,8-Mar-17,513,,
17,QDR380,Bnibh bet ba ba ba bnonummy ba bid bcursus.,8-Mar-17,513,,
17,GOB710,Bnisl bat ba bsit bcum bac bsed ba.,8-Mar-17,511,,
17,SZP362,Borci but ba ba.,8-Mar-17,607,,
17,QDR380,Burna bid ba ba bid bcras benim.,8-Mar-17,513,209,200
17,FIX581,Bnunc bat ba ba.,8-Mar-17,629,,
17,SZP362,Bquis bid ba best ba ba ba bclass bturpis beni best bmi beget.,8-Mar-17,607,,
17,FIX581,Bamet beu ba bfames bfermentum.,8-Mar-17,629,,
17,QDR380,Berat but barcu ba ba bnam bmi benim ba ba.,8-Mar-17,513,,
17,SZP362,Bamet bat ba beu.,8-Mar-17,607,,
17,SZP362,Belit bat.,8-Mar-17,607,,
17,AJF195,Berat bad bmi.,8-Mar-17,515,,
17,FIX581,Borci bac ba.,8-Mar-17,629,,
17,AJF195,Bamet bmi.,8-Mar-17,515,,
17,QVP853,Bodio bat ba berat bve ba bsed.,8-Mar-17,629,,
17,FIX581,Beros bve ba bnunc ba ba ba ba.,8-Mar-17,629,,
17,FIX581,Bdiam bat but bmi beu ba ba.,8-Mar-17,629,,
17,AJF195,Bodio bac.,8-Mar-17,515,,
17,FIX581,Bduis bid ba bve ba ba.,8-Mar-17,629,,
17,TFX540,Bante bin ba beros.,8-Mar-17,209,,
17,GQV369,Belit bat bve bmi ba ba bmagnis ba ba ba bnibh.,8-Mar-17,409,,
17,LVP764,Bquis bet begestas bfacilisi bvel ba.,8-Mar-17,515,,
17,GQV369,Bduis bad.,8-Mar-17,409,,
17,GQV369,Bnisl bat bve.,8-Mar-17,409,,
17,PMN417,Bnisi bve ba bac bper ba bmorbi ba bnibh ba ba btorquent bcras.,8-Mar-17,509,409,400
17,TRL028,Burna bet ba ba ba bid ba but bmus beni ba.,8-Mar-17,413,,
17,GQV369,Belit bet ba brisus.,8-Mar-17,409,,
17,GQV369,Beget bad ba bneque bid.,8-Mar-17,409,,
17,TMZ629,Bnibh bad ba ba ba bvitae bduis bnostra ba blibero bat bsemper.,8-Mar-17,507,,
17,TMZ629,Borci bat ba bsapien bnec ba bve bmassa bet.,8-Mar-17,507,,
17,TMZ629,Bnunc bac ba bac ba ba bsem but bdolor.,8-Mar-17,507,,
17,EUZ386,Bquis bac.,8-Mar-17,509,409,400
17,NKM173,Bduis bat ba ba bsemper ba bsemper bad ba baenean ba.,8-Mar-17,517,,
17,TYA561,Bamet bad.,8-Mar-17,629,,
17,TYA561,Bduis bve ba bin.,8-Mar-17,629,,
17,TYA561,Berat bve ba ba ba beu ba ba.,8-Mar-17,629,,
17,NKM173,Bnibh bve bad bquis ba bsed ba bporta ba best.,8-Mar-17,517,,
17,QZB271,Bpede bmi bac ba ba bnisl ba bsit ba binteger bvarius bvehicula beu bleo bmi bac bdui.,8-Mar-17,409,,
17,TMZ629,Bnibh bet ba bvelit bnon but bmollis btaciti ba ba bin burna bsit bac ba bpede blibero ba.,8-Mar-17,507,,
17,TMZ629,Bduis beu bnunc bdui ba bmassa bamet bhendrerit bvel ba ba.,8-Mar-17,507,,
17,TEP325,Bduis but ba bnam bmorbi bblandit bturpis bbibendum bmi bnon.,8-Mar-17,413,,
17,NKM173,Bduis bet bgravida bproin.,8-Mar-17,517,,
17,TEP325,Bduis bid.,8-Mar-17,413,,
17,PMN417,Bcras bin ba bad.,8-Mar-17,509,,
17,TEP325,Belit beu ba bcursus bac bmattis bquam ba bcommodo bsem ba bquis.,8-Mar-17,413,,
17,XLW275,Bante bac ba bvel bligula ba ba.,8-Mar-17,515,,
17,NKM173,Beros bin.,8-Mar-17,517,,
17,TMZ629,Berat but.,8-Mar-17,507,,
17,XLW275,Bnisl bet but benim.,8-Mar-17,515,,
17,TMZ629,Burna but ba ba.,8-Mar-17,507,,
17,UBJ603,Beget bac bad bmus bnec bfames btempus bfames bporta ba bet ba baenean.,8-Mar-17,629,,
17,TMZ629,Bdiam bat bet.,8-Mar-17,507,,
17,UBJ603,Bnisl beu ba bhac bproin ba btellus bfames ba ba ba ba bquis ba bdiam.,8-Mar-17,629,,
17,TRL028,Beget bat bquis ba ba ba beni ba.,8-Mar-17,209,,
17,XLW275,Bpede bat ba but bnetus ba ba.,8-Mar-17,515,,
17,UBJ603,Benim bve ba ba ba beros bnec.,8-Mar-17,629,,
17,XLW275,Bnunc bin ba but bnam bmi barcu ba ba.,8-Mar-17,515,,
17,NUR218,Bnisi bve ba bsodales blibero ba.,8-Mar-17,517,509,500
17,NUR218,Barcu bin ba bin bcongue ba ba bnetus brutrum ba ba brutrum bac ba.,8-Mar-17,517,509,500
17,USD901,Bcras beu ba.,8-Mar-17,629,,
17,USD901,Berat bin ba bcum but bnisi bamet bhac.,8-Mar-17,629,,
17,YGL283,Bcras bmi.,8-Mar-17,409,,
17,USD901,Beros bad.,8-Mar-17,629,,
17,YGL283,Bquam bid.,8-Mar-17,409,,
17,EJH762,Beget beu ba bmattis ba.,8-Mar-17,107,,
17,YGL283,Burna but bat ba ba burna ba ba bmi bduis bnon bmi.,8-Mar-17,409,,
17,USD901,Beros bmi.,8-Mar-17,629,,
17,YGL283,Belit bid ba baptent bsit ba bduis bcum ba blibero bhendrerit bpretium ba bac bmagna ba ba bid.,8-Mar-17,409,,
17,NKE126,Beros bin.,8-Mar-17,413,,
17,MHU637,Bnisi bve beu bhac ba ba bin.,8-Mar-17,513,,
17,USD901,Bnisl bve ba bin bnetus ba bnetus bcursus.,8-Mar-17,629,,
17,DZV145,Belit bad ba bid bnon bleo beu bmi.,8-Mar-17,517,,
17,USD901,Bnunc bac.,8-Mar-17,629,,
17,DZV145,Barcu beu ba blacus ba bodio ba ba.,8-Mar-17,517,,
17,ZDI213,Bnisl bet ba bper ba bsuscipit belit but ba beu.,8-Mar-17,509,409,400
17,SNI285,Burna beu.,8-Mar-17,507,,
17,SNI285,Bnunc but ba binceptos beros ba ba ba.,8-Mar-17,507,,
17,DZO637,Beget bac ba beu bfusce bad ba beu.,8-Mar-17,513,,
17,SNI285,Borci bac ba bper bnunc bodio bid ba ba ba bpotenti.,8-Mar-17,507,,
17,PMN417,Bquis bet ba ba ba.,8-Mar-17,509,409,400
17,SNI285,Bodio but ba bdis bmi ba baliquam bet ba bquam bet.,8-Mar-17,507,,
17,NKE126,Bcras bin ba berat bodio baptent ba.,8-Mar-17,209,,
17,CQU695,Burna but.,8-Mar-17,629,,
17,SNI285,Bduis beu ba bmi bplatea bmagnis bad bvitae bac ba bdis.,8-Mar-17,507,,
17,CQU695,Belit bve.,8-Mar-17,629,,
17,SNI285,Bdiam bac bat bquis bquam ba ba btellus bpede bdui bet.,8-Mar-17,507,,
17,SNI285,Borci bin bnisl ba ba bdolor bin ba bodio bdui ba.,8-Mar-17,507,,
17,CQU695,Barcu bin ba bleo bullamcorper ba.,8-Mar-17,629,,
17,TEP325,Burna beu bquam ba blectus ba blectus bac ba bmus.,8-Mar-17,209,,
17,CQU695,Bdiam bat ba bdictumst.,8-Mar-17,629,,
17,SNI285,Bnibh bet bat.,8-Mar-17,507,,
17,SIW958,Bdiam but ba ba ba bid ba ba ba baptent ba blobortis bduis ba ba bsit ba bve.,8-Mar-17,607,,
17,ZDI213,Berat bve ba bin.,8-Mar-17,509,,
17,FMU279,Bquis bve bdiam bpede bsemper ba bconsectetuer bsem.,8-Mar-17,413,,
17,FMU279,Bnisl bat.,8-Mar-17,413,,
17,RHX208,Bante bmi bin bpede bsemper bvelit.,8-Mar-17,409,,
17,FMU279,Barcu bve ba.,8-Mar-17,413,,
17,RHX208,Bcras but ba berat ba ba.,8-Mar-17,409,,
17,ZDI213,Bnisi bac bin bmi bet bmolestie ba ba.,8-Mar-17,509,,
17,ARS065,Bnunc bat ba bcras bid ba ba bad bid ba.,8-Mar-17,409,,
17,DZO637,Borci bet ba ba bmi blorem ba bparturient bac bad baugue ba ba.,8-Mar-17,513,273,200
17,DZO637,Burna bet ba bsapien ba but.,8-Mar-17,513,243,200
17,EJH762,Belit bin.,8-Mar-17,107,,
17,EJH762,Bnibh bve ba bin bsem ba bsem.,8-Mar-17,107,,
17,WQB451,Bquam bid ba bmollis ba but bnisi ba ba bvulputate bmassa bat ba ba ba.,8-Mar-17,507,401,400
17,WRT608,Barcu bat berat bplatea.,8-Mar-17,409,,
17,WQB451,Borci bac.,8-Mar-17,507,,
17,WQB451,Bcras bin blaoreet bamet ba ba bsem ba bnec.,8-Mar-17,507,,
17,WQB451,Berat bve but ba bmi.,8-Mar-17,507,,
17,WBH162,Borci bad ba.,8-Mar-17,629,,
17,WQB451,Bnibh bet ba bnunc.,8-Mar-17,507,,
17,RQJ940,Bpede bac ba ba bridiculus bvelit bat bmi bpurus.,8-Mar-17,513,,
17,WQB451,Benim bet ba bprimis.,8-Mar-17,507,,
17,TZO690,Bcras bin ba bquam ba bnam.,8-Mar-17,409,,
17,WQB451,Bpede bid ba beu beni bvel bmi beros ba.,8-Mar-17,507,,
17,CJQ075,Bquam bmi ba ba.,8-Mar-17,511,,
17,WBH162,Barcu bet bac.,8-Mar-17,629,,
17,RQJ940,Bquam bin.,8-Mar-17,513,,
17,WQB451,Bante bmi bat bhac ba bodio ba burna ba.,8-Mar-17,507,,
17,WBH162,Bamet but bad bcum bfaucibus bac btellus bduis.,8-Mar-17,629,,
17,TZO690,Bduis bac beu ba bhac ba ba bcursus ba bduis beu ba.,8-Mar-17,409,,
17,RQJ940,Benim bve ba berat ba ba ba bmi.,8-Mar-17,513,,
17,ERC382,Bnisl bin bnonummy bmassa bmi ba bnon ba bneque bmi ba bet bper.,8-Mar-17,413,,
17,NUX358,Bante bet bac bdonec bve ba ba beu ba.,8-Mar-17,409,,
17,PMG926,Beros bid ba ba ba ba ba ba baptent.,8-Mar-17,517,,
17,YHB831,Burna but ba ba ba bet bquam bmassa best ba ba.,8-Mar-17,517,505,500
17,OTS758,Barcu but ba ba biaculis bsit.,8-Mar-17,629,,
17,OTS758,Barcu bad beu ba ba ba ba ba ba ba btincidunt.,8-Mar-17,629,,
17,QMA357,Bdiam bac bnonummy baugue bnibh benim.,8-Mar-17,209,,
17,GIJ387,Bnisl bet.,8-Mar-17,107,,
17,YDL247,Bdiam bet bid bper bad ba ba ba ba ba.,8-Mar-17,511,,
17,OTS758,Bnunc bet ba ba ba bnibh ba ba ba bsit bmi.,8-Mar-17,629,,
17,GIJ387,Bquis bmi bconubia ba bsociis ba bnec ba.,8-Mar-17,107,,
17,QBR938,Bante bve ba ba bvel.,8-Mar-17,409,,
17,RQJ940,Bdiam beu ba blobortis ba ba bnonummy bcum.,8-Mar-17,513,,
17,PMG926,Bnisl but ba bnisi blitora ba.,8-Mar-17,517,,
17,QDR380,Beget beu but bid ba ba.,8-Mar-17,209,,
17,WTB963,Bnisl bad.,8-Mar-17,515,,
17,YDL247,Bante bet ba ba best bodio belit.,8-Mar-17,511,,
17,ERC382,Beros bve ba ba ba ba bmi ba beu ba brisus ba bfelis ba.,8-Mar-17,209,,
17,YDL247,Barcu bad ba bin ba ba bid.,8-Mar-17,511,,
17,JCM567,Borci bac.,8-Mar-17,513,273,200
17,GQV369,Beget bmi.,8-Mar-17,413,,
17,RAI572,Bdiam bad ba bet bper.,8-Mar-17,409,,
17,YGL283,Bnibh bve.,8-Mar-17,409,,
17,CSW718,Bnibh but.,8-Mar-17,515,,
17,KSX968,Bnibh bmi begestas bmolestie.,8-Mar-17,507,,
17,KSX968,Benim but ba ba ba bnec bnisl ba btellus ba.,8-Mar-17,507,,
17,YBJ023,Beget bac beu blacus bcongue ba.,8-Mar-17,409,,
17,GDR742,Bnisl but bve ba.,8-Mar-17,409,,
17,INW067,Bnisi bmi ba bhac bfermentum bodio bac bquisque bnetus borci bnec.,8-Mar-17,517,,
17,INW067,Barcu bat.,8-Mar-17,517,,
17,KSX968,Beros but ba ba bvel bquam bnunc.,8-Mar-17,507,,
17,KSX968,Beros beu ba.,8-Mar-17,507,,
17,KSX968,Bquam beu bac bdiam bsed bad.,8-Mar-17,507,,
17,INW067,Burna bve ba ba bcurae.,8-Mar-17,517,507,500
17,KSX968,Bnisi bid ba bnisi ba blacus bdiam ba blitora ba bultrices ba beni.,8-Mar-17,507,,
17,USH564,Borci bmi ba bporta bsed bnam bmi benim ba ba.,8-Mar-17,515,503,500
17,KSX968,Bamet bve brhoncus bfusce bante bfacilisis.,8-Mar-17,507,,
17,KSX968,Benim bve ba btortor ba blitora but.,8-Mar-17,507,,
17,KSX968,Bquis but ba ba ba.,8-Mar-17,507,,
17,KSX968,Bodio bin ba bvelit bduis ba bclass ba.,8-Mar-17,507,,
17,EUZ386,Borci bve ba ba.,8-Mar-17,513,209,200
17,KSX968,Bpede beu ba ba but beu bper bve bmagnis ba bin.,8-Mar-17,507,,
17,YDL247,Belit but ba bhac bsapien ba bhac barcu.,8-Mar-17,511,,
17,KSX968,Bquam bac bin btellus.,8-Mar-17,507,,
17,YGL283,Berat bat ba ba bmontes ba bac bnostra bdonec bnec bvel ba bmassa bin bat.,8-Mar-17,413,,
17,QDR380,Bpede bve bac bin bnec bper ba bmauris ba bet bproin ba ba bhabitasse.,8-Mar-17,517,,
17,QDR380,Bnibh beu bin bmassa bdictum ba.,8-Mar-17,517,,
17,AJF195,Bante bin.,8-Mar-17,629,,
17,QDR380,Beros bat ba bnibh ba ba blorem blacinia.,8-Mar-17,517,,
17,QDR380,Borci bet blaoreet bcras ba ba bat.,8-Mar-17,517,,
17,RHX208,Bnunc bat ba bat ba ba bin.,8-Mar-17,413,,
17,RHX208,Bodio bet ba borci.,8-Mar-17,413,,
17,RHX208,Bpede bid ba bac ba bnisl ba bsem.,8-Mar-17,413,,
17,MHU637,Bante bad ba ba bmi bleo bat.,8-Mar-17,209,,
17,JBQ468,Bnibh bat ba bvel ba bmus ba bdis ba.,8-Mar-17,629,,
17,RHX208,Bnunc bac ba.,8-Mar-17,413,,
17,JBQ468,Bnibh bid ba bdis ba bante ba bcras ba ba brutrum bhymenaeos ba blibero bet.,8-Mar-17,629,,
17,JBQ468,Bnunc bid ba ba bet ba blorem bmi.,8-Mar-17,629,,
17,JBQ468,Berat but ba bnisl ba but bsit.,8-Mar-17,629,,
17,UBZ174,Beros bid bac belit.,8-Mar-17,629,,
17,GIJ387,Bnibh bid ba bblandit but ba bquam bsapien.,8-Mar-17,107,,
17,GIJ387,Bnisi bac.,8-Mar-17,107,,
17,GIJ387,Bcras bac ba bprimis bleo bat.,8-Mar-17,107,,
17,GQV369,Benim bac ba bve btellus bneque best bmus bpurus bdolor but ba.,8-Mar-17,209,,
17,XFN395,Bnisl bad baliquet ba.,8-Mar-17,507,,
17,XVO159,Benim bid ba bodio bmi but.,8-Mar-17,107,,
17,GFM783,Bnisi but ba ba.,8-Mar-17,511,,
17,JOM027,Bnisl bin ba.,8-Mar-17,515,,
17,XFN395,Bquam bad ba ba.,8-Mar-17,507,,
17,RAI572,Bpede bet berat ba.,8-Mar-17,409,,
17,XFN395,Bdiam bid ba ba.,8-Mar-17,507,,
17,JOM027,Bquam bet bac belit bat ba bmi bve.,8-Mar-17,515,,
17,XFN395,Bdiam bmi bnisl bsit ba bsit ba ba.,8-Mar-17,507,,
17,XFN395,Bnisi bve ba best bsit ba bquisque baliquam ba bconsectetuer.,8-Mar-17,507,,
17,RQJ940,Barcu bid bcras bproin bin.,8-Mar-17,209,,
17,XFN395,Bodio bve ba.,8-Mar-17,507,,
17,XFN395,Beros bat beget ba bipsum beni ba ba ba bve bfacilisi.,8-Mar-17,507,,
17,XFN395,Bduis bmi ba ba.,8-Mar-17,507,,
17,XFN395,Bnisl but brhoncus bpharetra bleo ba bsit.,8-Mar-17,507,,
17,XFN395,Bodio but benim bante bper bid best bsit bve.,8-Mar-17,507,,
17,CJQ075,Bdiam bac ba bnon bamet bnibh benim bdolor ba bnon.,8-Mar-17,515,503,500
17,XFN395,Bnisl bin ba.,8-Mar-17,507,,
17,XFN395,Bquis but ba bnisi ba.,8-Mar-17,507,,
17,EUZ386,Benim bmi beu bper but bporta ba btorquent ba ba bquisque.,8-Mar-17,513,,
17,YAP829,Bquis bid.,8-Mar-17,409,,
17,MHU637,Bodio bmi ba.,8-Mar-17,517,,
17,MHU637,Beros bet.,8-Mar-17,517,,
17,OTX594,Bduis but ba borci bmontes bmorbi bdolor bve beu.,8-Mar-17,629,,
17,YGL283,Bpede bad bet ba but.,8-Mar-17,209,,
17,XWK825,Belit bve ba bsem ba ba ba but bmagnis bvitae ba bplacerat ba.,8-Mar-17,629,,
17,RHX208,Barcu bin.,8-Mar-17,209,,
17,XWK825,Belit bin ba ba.,8-Mar-17,629,,
17,XWK825,Burna bac ba ba ba bet ba ba.,8-Mar-17,629,,
17,TMZ629,Bduis bmi ba ba bvitae.,8-Mar-17,511,,
17,TEP325,Berat beu.,8-Mar-17,507,,
17,TEP325,Bnunc bad ba ba bfelis bnatoque.,8-Mar-17,507,,
17,WRT608,Bduis but ba bvivamus bsem but bve bnulla ba.,8-Mar-17,413,,
17,XWK825,Bpede beu ba bauctor bvitae bmus bdis.,8-Mar-17,629,,
17,TEP325,Bnibh bat ba ba ba beu bante bduis.,8-Mar-17,507,401,400
17,WRT608,Bnunc but ba ba ba ba bnam bin ba bper.,8-Mar-17,413,,
17,TEP325,Bnisi but ba ba ba bid bac bnec bmus blectus borci bat.,8-Mar-17,507,,
17,WRT608,Bpede bid ba ba binterdum bamet ba ba.,8-Mar-17,413,,
17,TEP325,Bpede bet.,8-Mar-17,507,,
17,TEP325,Benim beu ba beu ba ba ba bmontes bdonec ba beu ba.,8-Mar-17,507,,
17,TEP325,Bcras bat ba beu ba bac bauctor bfusce bdui.,8-Mar-17,507,,
17,TEP325,Barcu but ba.,8-Mar-17,507,,
17,DZO637,Beget bac bet bmetus bornare ba belit bnunc.,8-Mar-17,517,,
17,DZO637,Borci bid ba bmattis bmalesuada ba bnullam bsit baliquam bpurus bin ba bmi bcras bsem.,8-Mar-17,517,,
17,NUX358,Benim beu ba beu ba bac ba ba bsagittis bnunc.,8-Mar-17,413,,
17,GOB710,Bnibh bac ba bet bac but best bnec.,8-Mar-17,629,,
17,ZIQ738,Burna bac ba ba bgravida ba bin bnam.,8-Mar-17,409,,
17,SCZ739,Bodio bat ba bet ba bmus.,8-Mar-17,107,,
17,ZIQ738,Bnisi bat.,8-Mar-17,409,,
17,PMN417,Bduis bad ba ba ba ba ba.,8-Mar-17,513,273,200
17,LVP764,Bduis bat ba bad bsit bat bquam ba.,8-Mar-17,629,,
17,AMZ845,Bnibh bat ba ba beni bac ba best.,8-Mar-17,629,,
17,AMZ845,Bduis bid.,8-Mar-17,629,,
17,LVP764,Bnisi bac ba ba bpurus bamet bodio bin.,8-Mar-17,629,,
17,AMZ845,Bdiam bad ba ba barcu.,8-Mar-17,629,,
17,PMN417,Bodio bad bin burna bsapien ba bnec bin bpotenti.,8-Mar-17,513,243,200
17,YDL247,Bnibh bin ba bplatea bnon bper blibero ba.,8-Mar-17,515,209,200
17,PMN417,Bodio bve ba ba bclass ba bante ba beu bin best bid bsemper ba.,8-Mar-17,513,209,200
17,SCZ739,Bdiam bad ba ba ba ba beu bamet.,8-Mar-17,107,,
17,SNI285,Borci bet beget ba ba bquis ba bnullam ba ba beni bve ba bid baptent baugue.,8-Mar-17,511,,
17,FMU279,Bnisl bmi ba bnisl ba.,8-Mar-17,507,,
17,EZQ530,Bnisi beu ba bat bvarius bduis beu ba.,8-Mar-17,409,,
17,FMU279,Bante bet ba ba brutrum bproin bvitae bconsectetuer bdapibus benim.,8-Mar-17,507,401,400
17,FMU279,Bante bin beu ba best ba btorquent ba bdui.,8-Mar-17,507,,
17,FMU279,Bodio bmi ba ba ba ba.,8-Mar-17,507,,
17,FMU279,Bamet bve.,8-Mar-17,507,,
17,ZDI213,Bpede beu bdiam bante ba bvenenatis bnetus.,8-Mar-17,513,,
17,FMU279,Borci bat ba bmus ba bsit.,8-Mar-17,507,,
17,THO850,Bdiam bac ba bsemper biaculis ba bid ba ba bvarius ba best bin ba.,8-Mar-17,409,,
17,RQJ940,Berat bmi ba bvelit bfringilla bhac ba ba bnetus.,8-Mar-17,517,,
17,GDR742,Benim bid.,8-Mar-17,413,,
17,GDR742,Bante bid ba bmolestie ba best bfames bat ba bve bporta ba.,8-Mar-17,413,,
17,RQJ940,Bpede bad bet beu ba ba ba bprimis.,8-Mar-17,517,,
17,KSP816,Bante bad bin ba ba ba baugue bnibh bnisl bturpis ba.,8-Mar-17,629,,
17,GOB710,Beros beu ba bipsum benim bduis.,8-Mar-17,515,,
17,KSP816,Bante bve bid bmi bsit.,8-Mar-17,629,,
17,KSP816,Belit bid ba bhac ba bet ba ba ba ba beget bduis.,8-Mar-17,629,,
17,QMA357,Berat beu bve bcum.,8-Mar-17,509,409,400
17,KSP816,Bante bet ba bmi btincidunt bad ba ba bdis ba ba ba bvel bnisi ba.,8-Mar-17,629,,
17,WQB451,Belit bmi ba.,8-Mar-17,511,,
17,ZDI213,Bnunc but ba.,8-Mar-17,513,,
17,EZQ530,Berat beu ba baenean.,8-Mar-17,409,,
17,QMA357,Bpede bac ba ba bsapien bfaucibus ba ba ba.,8-Mar-17,509,,
17,EZQ530,Bdiam bet.,8-Mar-17,409,,
17,RAI572,Beget bid ba belit ba ba ba.,8-Mar-17,209,,
17,EZQ530,Barcu bve ba borci ba.,8-Mar-17,409,,
17,ZDI213,Beros bac bid bvarius bproin.,8-Mar-17,513,,
17,WQB451,Bodio bat ba ba badipiscing.,8-Mar-17,511,,
17,SPA495,Bnibh but bin ba bdolor belit bquis bmagna bve bmollis ba bjusto ba.,8-Mar-17,413,,
17,UWT728,Barcu beu bpretium.,8-Mar-17,205,,
17,SPA495,Bnunc bmi ba ba bac ba bornare ba ba ba bcras bproin.,8-Mar-17,413,,
17,SPA495,Burna bmi ba ba ba ba beros.,8-Mar-17,413,,
17,GQV369,Bamet bac ba but bmassa baptent ba ba bmus btempus beget bvel ba ba bve ba ba.,8-Mar-17,509,,
17,ERC382,Borci bac ba bhac bin bac borci bprimis.,8-Mar-17,507,,
17,ERC382,Bamet bid.,8-Mar-17,507,,
17,ERC382,Bpede but ba.,8-Mar-17,507,,
17,ARS065,Borci bad borci bac.,8-Mar-17,409,,
17,ERC382,Bodio bin ba bjusto ba bnam bac.,8-Mar-17,507,,
17,ERC382,Bquam bve borci btempor bcurae bmus bsit beget ba.,8-Mar-17,507,,
17,ERC382,Bnisi bid ba ba ba ba brutrum binteger ba bac.,8-Mar-17,507,,
17,ERC382,Bquam bmi.,8-Mar-17,507,,
17,OWH831,Bante bet baliquam.,8-Mar-17,409,,
17,ERC382,Berat beu ba ba ba.,8-Mar-17,507,403,400
17,XLW275,Beget bid ba ba ba bac bcurae bdictum.,8-Mar-17,629,,
17,XLW275,Bante bad bdiam ba bnibh ba ba beu bin bsem ba.,8-Mar-17,629,,
17,XLW275,Bquam bat.,8-Mar-17,629,,
17,KSX968,Beros bin bve bquam bnibh bcursus bhac but bac bleo.,8-Mar-17,511,,
17,TZO690,Bnisl bin ba bmus bnullam but blibero ba bnibh.,8-Mar-17,409,,
17,INW067,Bodio bat.,8-Mar-17,517,203,200
17,TZO690,Belit bid bat.,8-Mar-17,409,,
17,RNH842,Benim bin ba but.,8-Mar-17,107,,
17,TZO690,Bante bid ba ba bduis but bat bdiam.,8-Mar-17,409,,
17,QZB271,Benim bve.,8-Mar-17,507,,
17,WXK853,Borci bat bconubia bipsum bamet ba.,8-Mar-17,629,,
17,WXK853,Bnisi but ba berat brutrum ba ba bquam ba.,8-Mar-17,629,,
17,WXK853,Bcras bid ba ba.,8-Mar-17,629,,
17,WXK853,Borci bve ba bac bsem bad biaculis.,8-Mar-17,629,,
17,WXK853,Beros bad.,8-Mar-17,629,,
17,WXK853,Bnunc bat ba bhac ba bmetus beros bmus ba.,8-Mar-17,629,,
17,WXK853,Burna bid ba ba bmattis ba ba.,8-Mar-17,629,,
17,LTV094,Borci bid bad barcu bturpis ba.,8-Mar-17,413,,
17,LTV094,Bpede but ba ba bin ba ba badipiscing bamet bmetus.,8-Mar-17,413,,
17,AJF195,Berat bve bpede bvarius bnon bnec ba ba bporta bleo.,8-Mar-17,517,,
17,WXK853,Borci bac.,8-Mar-17,629,,
17,QVP853,Belit bmi ba ba bcongue bcum bat bdui bfaucibus beu bcongue bsemper bsodales.,8-Mar-17,517,,
17,QZB271,Benim bat ba ba bid bad bvel beni belit ba ba bin bdiam bnec ba.,8-Mar-17,507,,
17,QZB271,Bquis bet beu ba belit ba bmi.,8-Mar-17,507,,
17,EUZ386,Bante bid blacinia ba bconsectetuer bante beni.,8-Mar-17,517,,
17,RNH842,Bnisl bid.,8-Mar-17,107,,
17,RNH842,Bdiam bad ba ba bphasellus bproin bid.,8-Mar-17,107,,
17,QZB271,Berat bid ba bsed bcurae.,8-Mar-17,507,,
17,QBR938,Bquis but ba ba ba ba bid bnibh.,8-Mar-17,409,,
17,TFX540,Burna bad ba beuismod ba bnetus bat bve beni.,8-Mar-17,513,,
17,TFX540,Bnisi bmi ba ba ba ba bconvallis bsit bve bamet ba ba bnonummy.,8-Mar-17,513,,
17,TPJ583,Bnibh bad ba blectus beni bsed bet.,8-Mar-17,629,,
17,TPJ583,Bquis bmi ba bad bligula bpurus ba bsed btaciti ba.,8-Mar-17,629,,
17,RNH842,Belit bet ba bmattis.,8-Mar-17,107,,
17,TFX540,Bnibh bat bin bneque ba ba bve bsapien.,8-Mar-17,513,,
17,TPJ583,Bnisi bin bat bcum.,8-Mar-17,629,,
17,RNH842,Bnunc bat bad beu ba bad ba.,8-Mar-17,107,,
17,TFX540,Berat bad ba ba bnibh.,8-Mar-17,513,,
17,PVZ436,Bnisl bin bodio ba bvelit.,8-Mar-17,409,,
17,YAP829,Beros beu.,8-Mar-17,209,,
17,USH564,Bquam bid ba ba ba bjusto.,8-Mar-17,515,,
17,RNH842,Bdiam bet bin bcurae.,8-Mar-17,107,,
17,NUR218,Barcu bin ba ba bnam beu ba ba brisus ba.,8-Mar-17,629,,
17,NUR218,Barcu beu bmi ba ba.,8-Mar-17,629,,
17,NUR218,Bcras but.,8-Mar-17,629,,
17,PMN417,Bduis bid ba bsem best but ba.,8-Mar-17,517,,
17,TYA561,Bnisi bid ba bneque bac brutrum bcum bporta bpraesent.,8-Mar-17,607,,
17,TYA561,Bante bid bmi beu beni.,8-Mar-17,607,,
17,RNH842,Bnisi but ba bsem bpurus bmetus bodio bcras bleo.,8-Mar-17,107,,
17,PMN417,Bcras bat ba ba ba ba ba.,8-Mar-17,517,,
17,NUR218,Beget bet ba bad btaciti ba bturpis.,8-Mar-17,629,,
17,USH564,Bnisi bmi ba bdictum best ba bper ba bmi.,8-Mar-17,515,,
17,LED479,Bpede bat ba ba binterdum ba bper beu bat bid bamet bmi ba ba ba ba.,8-Mar-17,409,,
17,ZIQ738,Burna beu.,8-Mar-17,413,,
17,TYA561,Bpede but.,8-Mar-17,607,,
17,LED479,Benim bac ba bdiam bin ba.,8-Mar-17,409,,
17,TYA561,Bnisl bad ba ba bin ba bat bcum bjusto brutrum ba bsollicitudin bleo.,8-Mar-17,607,,
17,ZIQ738,Bnunc but ba ba bprimis bnec.,8-Mar-17,209,,
17,SNI285,Bnibh bid.,8-Mar-17,515,413,400
17,QZB271,Bpede bin ba.,8-Mar-17,507,401,400
17,TRL028,Beget bve ba beni bquam ba ba.,8-Mar-17,513,,
17,RHX208,Bpede bac ba ba ba ba bad bfusce bnostra ba ba baugue ba.,8-Mar-17,507,,
17,RHX208,Burna bmi ba btaciti bpretium ba bcubilia baliquet.,8-Mar-17,507,,
17,RHX208,Bpede beu ba ba ba ba ba bve beros ba ba ba bduis bat.,8-Mar-17,507,,
17,RHX208,Belit bin bad ba ba bid ba ba ba ba bproin.,8-Mar-17,507,,
17,RHX208,Bpede bmi ba ba ba bsociis ba baugue beros bnam bdui.,8-Mar-17,507,,
17,RHX208,Belit bac.,8-Mar-17,507,,
17,RHX208,Beget bad bac belit brisus.,8-Mar-17,507,,
17,XFN395,Barcu bve bduis borci blibero bdui bvitae bturpis ba.,8-Mar-17,511,,
17,RHX208,Barcu bad ba bdis ba baptent ba.,8-Mar-17,507,,
17,RHX208,Burna bat ba ba ba bad.,8-Mar-17,507,,
17,RHX208,Bnisl bmi ba.,8-Mar-17,507,,
17,TRL028,Bante bve bmi bleo bligula ba bpraesent ba bcum borci beget ba ba bamet ba bnam.,8-Mar-17,513,,
17,GSF615,Bnisl bid ba bat.,8-Mar-17,205,,
17,RHX208,Bpede bac ba btellus ba bcum bmus but belit beu ba but ba ba ba ba.,8-Mar-17,507,401,400
17,TRL028,Benim beu ba bneque bprimis.,8-Mar-17,513,,
17,TEP325,Belit beu bet ba bper bin bquam bcursus bmassa bfames.,8-Mar-17,511,,
17,DPL397,Borci beu.,8-Mar-17,409,,
17,DPL397,Bnibh bad ba bnisl ba ba ba ba ba.,8-Mar-17,409,,
17,KAH129,Bnisi bat ba ba ba ba ba.,8-Mar-17,107,,
17,GPJ498,Bnisi bin ba ba ba bmi.,8-Mar-17,629,,
17,VFR160,Benim but ba bnec but bdonec beu bnec ba ba beu.,8-Mar-17,409,,
17,TEP325,Bodio bet bsodales ba but bdui ba ba beu bsem.,8-Mar-17,511,,
17,YGL283,Bcras beu bat ba bac ba ba bleo bvitae bligula bipsum ba baccumsan ba.,8-Mar-17,509,,
17,GPJ498,Bnunc bve ba btaciti ba bnec bconsequat bquam bmassa.,8-Mar-17,629,,
17,RQJ940,Bante bin ba bporta ba bduis best bat.,8-Mar-17,629,,
17,EZQ530,Bdiam but ba bsit ba ba bid.,8-Mar-17,413,,
17,EZQ530,Burna beu ba bdui but.,8-Mar-17,413,,
17,EZQ530,Benim beu.,8-Mar-17,413,,
17,EZQ530,Bnibh beu ba.,8-Mar-17,209,,
17,EZQ530,Bquam bat ba beu bnec bid.,8-Mar-17,413,,
17,EZQ530,Beget bet bvivamus baugue bid ba ba bultricies bsem ba ba ba ba.,8-Mar-17,413,,
17,NUX358,Barcu bve bfeugiat bfames.,8-Mar-17,507,,
17,NUX358,Belit but ba bad.,8-Mar-17,507,,
17,CSW718,Beget bin blaoreet bcras ba.,8-Mar-17,515,,
17,EZQ530,Bduis bad ba blitora bcum bjusto bturpis ba ba.,8-Mar-17,413,,
17,NUX358,Bnunc bet bat.,8-Mar-17,507,401,400
17,YDL247,Bcras bad ba bvolutpat.,8-Mar-17,629,,
17,NUX358,Bpede bat ba but beu ba bsed ba baenean ba ba bmus.,8-Mar-17,507,,
17,NUX358,Barcu bac ba ba ba beu belit bpede.,8-Mar-17,507,,
17,NUX358,Borci but ba ba ba ba bsed bin bmorbi bmi bve bsed bplatea bac bante.,8-Mar-17,507,,
17,NUX358,Belit bac ba ba ba bsemper bnon bsit.,8-Mar-17,507,,
17,NUX358,Bamet bve ba.,8-Mar-17,507,,
17,BIP389,Berat bve ba bac ba beu ba bnetus bmagna.,8-Mar-17,509,,
17,KSP816,Belit bid ba ba ba bdictum belementum ba bmollis bsed bid.,8-Mar-17,607,,
17,TUQ327,Bamet bad bante bfames bnibh bve bin ba bvitae.,8-Mar-17,629,,
17,ARS065,Belit bid.,8-Mar-17,209,,
17,KSP816,Bnisl beu ba.,8-Mar-17,607,,
17,TUQ327,Bamet bid ba barcu ba bsit ba bcum bmorbi.,8-Mar-17,629,,
17,KSP816,Bquam but.,8-Mar-17,607,,
17,TUQ327,Bnisi bad ba bet.,8-Mar-17,629,,
17,KSP816,Bduis bat.,8-Mar-17,607,,
17,CSW718,Bante bet bac bcras belit bsapien ba bcum ba berat.,8-Mar-17,515,,
17,ICB356,Bquam bad ba bsem ba begestas bin bdiam.,8-Mar-17,409,,
17,PMG926,Bnunc bad ba bnam ba ba ba.,8-Mar-17,517,,
17,JCM567,Bquam but.,8-Mar-17,629,,
17,QMA357,Bcras bac ba beros ba ba ba bjusto.,8-Mar-17,513,209,200
17,PMG926,Borci bad ba bvitae bet ba bsit ba.,8-Mar-17,517,505,500
17,FMU279,Bamet bet ba.,8-Mar-17,511,,
17,GFM783,Benim but ba ba bnonummy ba brisus benim bsem ba ba.,8-Mar-17,629,,
