LOC,VEH_SER_NO,INSP_COMT,TS_LOAD,FOUND_INSP_TEAM,RESP_INSP_TEAM,RESP_INSP_OPRUNT
17,TQL981,Bnunc bmi bid ba ba.,7-Mar-17,629,,
17,FTO836,Benim bid bve benim.,7-Mar-17,607,,
17,TPD286,Bnibh bet bin ba btempus ba bmattis ba bquis burna ba.,7-Mar-17,517,,
17,FTO836,Berat bet ba borci ba.,7-Mar-17,607,,
17,FTO836,Bnisi bin ba ba beros.,7-Mar-17,607,,
17,MGF879,Bnibh beu ba brisus ba ba ba bve bad bper bac benim.,7-Mar-17,413,,
17,MGF879,Bnisl bet bat bnec bsit ba bdiam.,7-Mar-17,413,,
17,FHL057,Bquam but ba bve baptent bmetus ba bnisl ba.,7-Mar-17,511,,
17,SOU593,Burna bad but.,7-Mar-17,507,411,400
17,FTO836,Bpede bin ba bsapien bmalesuada ba bmauris ba bdictum.,7-Mar-17,607,,
17,JYI091,Bodio bet.,7-Mar-17,629,,
17,FHL057,Bante beu.,7-Mar-17,511,,
17,SOU593,Bnunc bve ba.,7-Mar-17,507,401,400
17,FTO836,Berat bmi ba but ba borci.,7-Mar-17,607,,
17,SOU593,Bnisl bin but bsuscipit ba ba.,7-Mar-17,507,,
17,ELJ539,Bduis beu bgravida bduis ba.,7-Mar-17,205,,
17,FTO836,Bquam but.,7-Mar-17,607,,
17,SOU593,Bnunc beu ba beni bnisi ba bnulla ba ba.,7-Mar-17,507,,
17,FHL057,Bpede but ba ba ba ba ba.,7-Mar-17,511,,
17,SOU593,Beros bac bpretium bvitae but.,7-Mar-17,507,,
17,FHL057,Beros bin ba bfusce.,7-Mar-17,511,,
17,SOU593,Bnisl beu ba.,7-Mar-17,507,,
17,FHL057,Bnisl bmi beu bsit bquisque bmi ba bad bmassa.,7-Mar-17,511,,
17,BEM390,Bduis bac ba bet baccumsan ba bdis bquam bcras.,7-Mar-17,629,,
17,BIP389,Bnisi but bat ba ba blorem bve.,7-Mar-17,409,,
17,BIP389,Bnisl bid.,7-Mar-17,409,,
17,QJP284,Bnisi bet bid bet ba ba bad bnon ba ba ba baugue bfacilisi.,7-Mar-17,209,,
17,QJP284,Benim bac.,7-Mar-17,209,,
17,CXD285,Bante bad ba ba ba.,7-Mar-17,629,,
17,PEK163,Bpede bve bad ba barcu ba ba bve.,7-Mar-17,629,,
17,SVP127,Bnisi bad bpretium ba bin.,7-Mar-17,409,,
17,PEK163,Bnunc bac.,7-Mar-17,629,,
17,SVP127,Bnunc bid ba beni bclass bmagna ba bper ba bnec btaciti.,7-Mar-17,409,,
17,MBP046,Bcras bac ba bve ba.,7-Mar-17,513,,
17,SVP127,Benim bmi bat ba blacus but ba bnibh bad ba ba ba ba ba.,7-Mar-17,409,,
17,IFP328,Bdiam bet ba brutrum ba ba.,7-Mar-17,205,,
17,PEK163,Bnunc bat ba bridiculus bsollicitudin barcu bcum.,7-Mar-17,629,,
17,AKC912,Bante bad but ba benim.,7-Mar-17,515,,
17,MBP046,Bquis bmi baliquam bnulla bid ba bleo ba bve ba bnonummy ba bper ba bduis ba ba.,7-Mar-17,513,,
17,MBP046,Beget bad.,7-Mar-17,513,,
17,AKC912,Bante bet ba ba bnam ba ba bac bdui ba.,7-Mar-17,515,,
17,IXM739,Bamet beu binteger bcurae bmi ba baptent bvivamus ba bet ba ba.,7-Mar-17,509,,
17,DTP539,Bdiam bve.,7-Mar-17,517,,
17,DTP539,Bdiam bve.,7-Mar-17,517,,
17,TUQ327,Benim bin.,7-Mar-17,409,,
17,TUQ327,Bduis beu ba bfeugiat bcum ba.,7-Mar-17,409,,
17,IXM739,Beget bve bid bcum ba ba.,7-Mar-17,509,,
17,PRA475,Bquam bin ba bleo bpenatibus bdictum but ba bcum bmorbi ba bodio bin bmi.,7-Mar-17,413,,
17,TUQ327,Burna bid bin bfusce ba bin ba bfermentum.,7-Mar-17,409,,
17,PRA475,Berat bet ba bvel.,7-Mar-17,413,,
17,TUQ327,Belit bve ba ba ba bnetus bsodales.,7-Mar-17,409,,
17,BRL042,Belit bat ba ba bnonummy btellus ba.,7-Mar-17,513,,
17,TCS146,Bquis bat ba blitora bdictumst.,7-Mar-17,629,,
17,PRA475,Bquis bat.,7-Mar-17,413,,
17,TCS146,Bamet bin bgravida.,7-Mar-17,629,,
17,EJO928,Bduis bac bad blacus ba ba ba.,7-Mar-17,507,411,400
17,TCS146,Benim bac ba ba ba blectus ba ba bhendrerit ba burna ba ba.,7-Mar-17,629,,
17,PRA475,Benim bac ba ba barcu bfelis beni bsem bad baliquet ba bsit bid bdolor bat ba.,7-Mar-17,413,,
17,TCS146,Bdiam bve bid beni ba barcu ba bad benim bmollis ba.,7-Mar-17,629,,
17,EJO928,Bquam bve ba bfames biaculis bvel bmi bid.,7-Mar-17,507,401,400
17,TCS146,Bcras bet ba blacus bad ba ba bante ba bpurus ba bcurae.,7-Mar-17,629,,
17,EJO928,Beget bat ba bad bvarius ba bcurabitur bin ba bdui bpede ba.,7-Mar-17,507,,
17,EJO928,Bcras bid ba.,7-Mar-17,507,,
17,EJO928,Berat bid ba ba bnon bnunc bquis.,7-Mar-17,507,,
17,EJO928,Barcu bet ba ba ba bac.,7-Mar-17,507,,
17,EJO928,Beget bid bad ba bfusce bduis.,7-Mar-17,507,,
17,BRL042,Barcu beu bpretium ba bsemper ba ba ba bdis bmagna.,7-Mar-17,513,209,200
17,SVP127,Bnisi bin ba bid bnostra ba ba.,7-Mar-17,409,,
17,SVP127,Barcu beu.,7-Mar-17,409,,
17,HMX073,Belit but ba bad beu ba ba bpurus bin ba bsociis bnon.,7-Mar-17,517,501,500
17,ACM236,Bquis bac ba bve bquam bet ba but ba ba bet bvel bve.,7-Mar-17,511,,
17,HMJ710,Bpede bin bet ba ba brisus bsollicitudin bnisl btempus ba.,7-Mar-17,509,,
17,ACM236,Bamet bat ba best bproin ba.,7-Mar-17,511,,
17,HMX073,Bnibh bet bve.,7-Mar-17,517,507,500
17,TPG078,Bodio bmi bac bdiam bquam ba bporttitor bcubilia ba bsit ba.,7-Mar-17,513,273,200
17,ACM236,Beros bid.,7-Mar-17,511,,
17,ACM236,Bpede bid.,7-Mar-17,511,,
17,ACM236,Belit beu.,7-Mar-17,511,,
17,XGW598,Bamet bmi ba ba ba ba bipsum ba best ba bet.,7-Mar-17,517,,
17,IFP328,Bnunc bmi bviverra brisus bad bturpis bdui bposuere bin.,7-Mar-17,409,,
17,ELJ539,Beget bat bid ba ba bnec bnullam ba.,7-Mar-17,409,,
17,ELJ539,Borci beu.,7-Mar-17,409,,
17,VGZ416,Barcu bmi bve ba bsociis bleo bmetus ba badipiscing but bad bsed bvarius.,7-Mar-17,107,,
17,VGZ416,Bnunc bve but bmus ba.,7-Mar-17,107,,
17,XGW598,Bnisl bet ba bsed but beleifend ba best bodio ba ba ba ba.,7-Mar-17,629,,
17,FIX581,Bnisl bmi.,7-Mar-17,209,,
17,GDU671,Bnibh bve ba bmolestie bquis ba bprimis ba ba bpede bnam bet bat bamet ba bornare.,7-Mar-17,607,,
17,GDU671,Bante but ba ba blorem bpurus ba bnec.,7-Mar-17,607,,
17,CNZ205,Belit bac bnonummy bodio ba bcommodo bhac.,7-Mar-17,629,,
17,EUL768,Bdiam bac ba bcongue ba btaciti bdis ba belit.,7-Mar-17,513,,
17,IFP328,Borci bmi ba borci.,7-Mar-17,409,,
17,VGZ416,Berat bat bve ba ba bnunc ba ba.,7-Mar-17,107,,
17,IBA235,Benim bad ba ba ba.,7-Mar-17,515,,
17,IFP328,Bpede bet ba bsit ba bad bconvallis.,7-Mar-17,409,,
17,AMZ845,Bquam but bquisque ba bdictum.,7-Mar-17,507,,
17,JPU485,Bpede bet ba bid ba bin baliquam ba bid beni ba.,7-Mar-17,409,,
17,AMZ845,Bnisl bat ba ba ba bhac bproin ba bnec.,7-Mar-17,507,,
17,AMZ845,Bquis bac bid ba betiam ba bper bvitae bnascetur bmassa bamet beros bluctus bvitae.,7-Mar-17,507,,
17,JPU485,Bnunc bac bat bin bleo beu ba.,7-Mar-17,409,,
17,XPR275,Bcras bve ba bcras bac.,7-Mar-17,511,,
17,AMZ845,Bnibh bmi.,7-Mar-17,507,,
17,AMZ845,Burna bmi ba bsed ba bad ba beni bsuspendisse ba bat berat bdis.,7-Mar-17,507,,
17,XPR275,Bodio bad ba bhac bat bnon bconubia bnetus.,7-Mar-17,511,,
17,AMZ845,Bnibh bmi.,7-Mar-17,507,,
17,AMZ845,Belit but bve bnisl bmetus bsed bvel bat bnon bad bcurae bad.,7-Mar-17,507,409,400
17,ZYA587,Bnisl bid.,7-Mar-17,517,,
17,AMZ845,Bamet bve bid ba beros ba blacus bvel bper ba ba baptent bvel bdonec.,7-Mar-17,507,409,400
17,SYB619,Bcras beu ba bmauris ba ba.,7-Mar-17,629,,
17,AMZ845,Bquis beu bpotenti bmagna ba bcursus bvelit.,7-Mar-17,507,,
17,AMZ845,Beget but.,7-Mar-17,507,,
17,SYB619,Bante bid bposuere bfaucibus bsit ba ba bsem bnisl barcu.,7-Mar-17,629,,
17,AMZ845,Beget beu ba bodio.,7-Mar-17,507,,
17,GPJ498,Berat beu ba ba ba bfusce bconsequat bnec.,7-Mar-17,409,,
17,UHP854,Bnisi but bet ba ba bin btempus bauctor bac bprimis.,7-Mar-17,209,,
17,UHP854,Belit bad ba ba beni.,7-Mar-17,209,,
17,EUL768,Bquis bac bvivamus bsenectus bper ba.,7-Mar-17,513,,
17,CSM507,Bodio bin ba ba ba ba ba but bnascetur ba ba bad bvel but bmi.,7-Mar-17,209,,
17,TUQ327,Belit bin bve ba belit ba bmagnis bad.,7-Mar-17,413,,
17,GYI954,Burna bid bmi beros bnisl ba.,7-Mar-17,511,,
17,HRY673,Bnunc beu ba beu.,7-Mar-17,629,,
17,OSR174,Bante bve ba.,7-Mar-17,205,101,100
17,GYI954,Bdiam bet ba ba.,7-Mar-17,511,,
17,AMZ845,Bamet bet ba.,7-Mar-17,507,,
17,OSR174,Bquam bad ba ba bmi ba.,7-Mar-17,205,,
17,VQD376,Bnibh bin.,7-Mar-17,507,411,400
17,SLP187,Bquis bat ba ba bin bve bin bmaecenas ba bvel.,7-Mar-17,517,505,500
17,VQD376,Beget but.,7-Mar-17,507,,
17,ZYA587,Bnibh beu ba but btristique bdictum.,7-Mar-17,517,,
17,VQD376,Bquam bid ba bturpis bduis ba but bquis ba bproin bnisl bdonec beu ba bid ba ba.,7-Mar-17,507,,
17,VQD376,Bcras bin ba bligula ba ba bneque.,7-Mar-17,507,,
17,JPU485,Belit bet beu ba ba.,7-Mar-17,409,,
17,VQD376,Burna bid ba ba ba barcu btortor ba.,7-Mar-17,507,,
17,MBP046,Beget bet ba ba baliquet ba but bsit ba bnullam ba.,7-Mar-17,517,,
17,YTP390,Bamet bad ba ba bve ba bmetus bprimis bid ba.,7-Mar-17,513,,
17,SLP187,Bnisl but ba bsemper ba bid bnam.,7-Mar-17,517,509,500
17,SLP187,Bduis bet ba.,7-Mar-17,517,,
17,USD901,Barcu bet ba bquis.,7-Mar-17,409,,
17,SLP187,Bnibh bmi ba ba bfacilisis baugue bet burna ba ba bnunc beu.,7-Mar-17,517,,
17,SIW958,Bnisi bat ba ba ba ba.,7-Mar-17,409,,
17,MQH836,Bnisl bve ba ba beni bante ba ba ba.,7-Mar-17,629,,
17,SLP187,Beget bad.,7-Mar-17,517,,
17,SLP187,Beget bet ba ba ba.,7-Mar-17,517,501,500
17,CVE258,Bpede bin bconubia bamet ba ba ba bnibh bet bac bdictum ba ba bad.,7-Mar-17,629,,
17,CVE258,Bnibh bve ba ba.,7-Mar-17,629,,
17,MGF879,Bnisl bve bante.,7-Mar-17,209,,
17,MRI015,Beros bac ba ba bid bat blacus beu ba.,7-Mar-17,629,,
17,HQD748,Bpede bad but ba bid bdiam bcras best bsapien.,7-Mar-17,509,,
17,LEA891,Berat bat.,7-Mar-17,409,,
17,MQH836,Belit bin ba ba ba bnunc bvelit ba bper.,7-Mar-17,517,501,500
17,QJP284,Bnibh but ba bnunc.,7-Mar-17,507,,
17,QJP284,Bante bac ba ba ba benim bsit ba brutrum bad ba but bve bdis beni bamet bdiam.,7-Mar-17,507,,
17,IXM739,Beros bmi ba bnulla ba berat bfusce ba ba ba ba ba beu.,7-Mar-17,513,,
17,QJP284,Burna bet ba berat ba ba ba bsapien ba.,7-Mar-17,507,,
17,AKC912,Bquis bad ba bprimis ba ba bmontes.,7-Mar-17,629,,
17,QJP284,Borci beu ba bvel beros.,7-Mar-17,507,,
17,QJP284,Bquam bet ba but blitora bet btortor bpurus.,7-Mar-17,507,,
17,QJP284,Bnisl bat bin bdui bsed bac beget ba ba bnec ba ba ba bin.,7-Mar-17,507,413,400
17,BRL042,Bnisl bve bnatoque bvelit ba bmus bmauris bsemper bmi ba.,7-Mar-17,517,,
17,AKC912,Beget beu.,7-Mar-17,629,,
17,BRL042,Benim but bmi burna ba ba ba bvel bmagnis bdis ba bposuere bvarius.,7-Mar-17,517,,
17,QJP284,Benim but.,7-Mar-17,507,,
17,WXK853,Bnisl but ba bvel bfelis bpotenti bnec.,7-Mar-17,511,,
17,SIW958,Bnisl beu ba bhac.,7-Mar-17,409,,
17,SIW958,Borci bin ba.,7-Mar-17,409,,
17,ALP937,Bcras bac ba ba bdapibus ba.,7-Mar-17,629,,
17,JYI091,Bnisl bet.,7-Mar-17,629,,
17,CSD174,Bodio bet.,7-Mar-17,629,,
17,VGZ416,Bpede bad ba ba ba btristique but ba ba bnisl ba burna.,7-Mar-17,107,,
17,CSD174,Bdiam bid ba ba ba ba ba.,7-Mar-17,629,,
17,CSD174,Bnisl bmi.,7-Mar-17,629,,
17,CQU695,Bante bin ba ba ba.,7-Mar-17,205,,
17,TPG078,Bdiam bmi ba ba bnon bamet ba bproin ba bquam bmassa.,7-Mar-17,517,,
17,CQU695,Bante but ba bdonec bproin beu ba belit ba ba bhac best btempor.,7-Mar-17,205,101,100
17,RCF947,Bquis bat.,7-Mar-17,629,,
17,IXM739,Berat bad ba bac ba.,7-Mar-17,513,,
17,RCF947,Bnisl bad.,7-Mar-17,629,,
17,QFW209,Borci bmi.,7-Mar-17,209,,
17,RCF947,Barcu bve ba bfacilisis bnibh but ba bvel ba bsed ba ba.,7-Mar-17,629,,
17,RCF947,Bamet bid bcras bcum bsed bvitae bnisi ba ba ba.,7-Mar-17,629,,
17,PGY640,Borci bet bve bnibh ba bvel bamet.,7-Mar-17,507,,
17,QFW209,Barcu beu ba ba bnon bnisi bduis ba.,7-Mar-17,209,,
17,RCF947,Burna bet but bnisi bcras best ba ba ba ba bve bvitae bin ba ba borci.,7-Mar-17,629,,
17,PGY640,Bnisl bac burna bdiam ba.,7-Mar-17,507,,
17,QFW209,Barcu bat bad ba ba beu bat ba bjusto.,7-Mar-17,209,,
17,IQS845,Bante bmi ba bac bante bvel ba ba.,7-Mar-17,629,,
17,PGY640,Bnisi bin bet bhac ba bad btincidunt bornare bad bauctor ba bfermentum bvel ba ba.,7-Mar-17,507,,
17,MRI015,Borci bmi bin bve best ba bsed ba bnetus ba bsit bsed baugue bvitae bid beu bvolutpat ba.,7-Mar-17,517,309,300
17,OSR174,Bante but ba bper ba ba bultricies binteger ba.,7-Mar-17,409,,
17,SZP362,Bpede bve bpede bsit ba bcum bante.,7-Mar-17,209,,
17,SOU593,Barcu bad bquam ba bmagnis bpede ba ba but ba ba ba bnon.,7-Mar-17,511,,
17,OSR174,Benim bmi ba bdiam beros.,7-Mar-17,409,,
17,SOU593,Beros bac ba bdui bet bclass bmauris ba bquis.,7-Mar-17,511,,
17,OSR174,Bcras bid ba betiam ba bleo bdis.,7-Mar-17,409,,
17,SOU593,Bante beu ba ba ba bve.,7-Mar-17,511,,
17,RIW219,Bamet bin bid ba ba bac ba bvel bad bante best bnam.,7-Mar-17,107,,
17,OSR174,Borci bin ba ba ba ba blacus ba.,7-Mar-17,409,,
17,DTP539,Barcu bid bmi ba ba ba blitora bper ba begestas.,7-Mar-17,629,,
17,CQU695,Bcras bve ba bsodales.,7-Mar-17,409,,
17,RIW219,Borci bid but bsenectus ba bmus.,7-Mar-17,107,,
17,TPG078,Beros bin.,7-Mar-17,517,,
17,WBH162,Bcras bac.,7-Mar-17,409,,
17,PGY640,Burna bet ba ba bin bad bnon.,7-Mar-17,507,,
17,JPU485,Bnunc bet.,7-Mar-17,413,,
17,IXM739,Bamet bve ba bdis ba ba ba bpenatibus ba bve bfermentum bneque bet ba.,7-Mar-17,513,,
17,EUL768,Burna bmi ba ba bnibh ba bvitae beros.,7-Mar-17,517,,
17,RIW219,Bnibh bet.,7-Mar-17,107,,
17,TQL981,Berat beu bac bnam bad.,7-Mar-17,629,,
17,YTP390,Bcras bac.,7-Mar-17,517,,
17,TQL981,Bcras bmi.,7-Mar-17,629,,
17,TQL981,Bodio bin begestas bnulla ba bsed ba bin btaciti ba btempor ba.,7-Mar-17,629,,
17,BIP389,Bquis but bvivamus betiam borci bnam ba ba bid bleo bsit.,7-Mar-17,209,,
17,BIP389,Bcras bac beget ba ba ba bconubia bsem ba.,7-Mar-17,209,,
17,RIW219,Borci bat ba bhac bnetus.,7-Mar-17,107,,
17,BIP389,Bante bad ba.,7-Mar-17,209,,
17,ZYA587,Bduis but ba bve bcum.,7-Mar-17,629,,
17,CQU695,Bante bet bac ba ba ba ba brutrum ba ba.,7-Mar-17,409,,
17,FIX581,Bamet bac ba bmagna.,7-Mar-17,509,,
17,FIX581,Bcras bet ba.,7-Mar-17,509,,
17,FIX581,Bquam bat ba bet ba bsed.,7-Mar-17,209,,
17,IBA235,Bquis bac beget bcongue ba bsenectus ba best.,7-Mar-17,629,,
17,EJO928,Bodio bve ba bsit bnibh ba bvelit bet bnam.,7-Mar-17,511,,
17,DVM139,Belit bid ba benim bvarius bdui ba bet blibero.,7-Mar-17,205,,
17,XGW598,Burna bet ba bornare bnascetur bid bsed ba baenean bcursus.,7-Mar-17,629,,
17,XGW598,Bnisi beu blacinia bquis ba.,7-Mar-17,629,,
17,FIX581,Bnisi bet bat bipsum bac.,7-Mar-17,509,,
17,UHP854,Benim bin ba bquam ba btincidunt bvitae bat.,7-Mar-17,507,411,400
17,CXD285,Bnibh bac bad betiam ba ba bporta ba bconvallis ba bat bleo bjusto.,7-Mar-17,607,,
17,UHP854,Beros bin ba bper bconsequat baptent bdis bat.,7-Mar-17,507,,
17,FIX581,Bamet bat burna ba bsapien bfringilla.,7-Mar-17,509,,
17,UHP854,Bdiam bin ba.,7-Mar-17,507,,
17,UHP854,Barcu bet ba ba ba bsed bid.,7-Mar-17,507,,
17,UHP854,Bduis beu bet beros.,7-Mar-17,507,,
17,WBH162,Barcu beu bconubia ba bmetus bdui bhac beu bmauris ba bporttitor.,7-Mar-17,409,,
17,UHP854,Belit bad ba bat bsem bat bporta ba ba.,7-Mar-17,507,,
17,WBH162,Bquis bet ba bad best ba bsit.,7-Mar-17,409,,
17,UHP854,Borci bid ba bvel ba best ba.,7-Mar-17,507,,
17,WBH162,Berat beu baliquam benim ba bmassa bsollicitudin borci bornare bhac ba.,7-Mar-17,409,,
17,FHL057,Bquam bid bpede berat ba bsodales bdis.,7-Mar-17,629,,
17,ELJ539,Beros bve barcu btempor bvitae bnec barcu ba.,7-Mar-17,209,,
17,UHP854,Bpede bid.,7-Mar-17,507,,
17,IBA235,Beget bmi ba bin ba bat bid beni bcongue bvitae ba bac bet best ba barcu ba ba ba bultricies.,7-Mar-17,517,413,400
17,IBA235,Benim bac ba.,7-Mar-17,517,503,500
17,UHP854,Beget bac ba ba bid ba ba bat bnisl.,7-Mar-17,507,,
17,FIX581,Berat bmi ba ba ba bac ba bmi.,7-Mar-17,509,,
17,UHP854,Bante bin.,7-Mar-17,507,,
17,UHP854,Bpede bat ba ba ba bgravida.,7-Mar-17,507,,
17,AKC912,Bante bmi.,7-Mar-17,517,,
17,FIX581,Bdiam bat ba ba.,7-Mar-17,509,,
17,AKC912,Bdiam beu bet bdonec.,7-Mar-17,517,409,400
17,IXM739,Barcu but beu bmassa beu bauctor.,7-Mar-17,517,,
17,UIS846,Bnisi bmi ba ba bve.,7-Mar-17,107,,
17,MVW427,Bnunc bat bcommodo bfusce bnisi but ba baugue bad.,7-Mar-17,513,,
17,IXM739,Bquam but ba bet brutrum barcu bve ba bet bsapien.,7-Mar-17,517,,
17,GPJ498,Borci bat.,7-Mar-17,409,,
17,MBP046,Berat bat ba bporta ba ba belementum bnibh bjusto bet ba.,7-Mar-17,629,,
17,IFP328,Benim bid.,7-Mar-17,209,,
17,UIS846,Burna but bac ba ba ba bfelis.,7-Mar-17,107,,
17,MBP046,Bduis bac ba bnec bpurus ba.,7-Mar-17,629,,
17,DKW659,Bante bet ba bcras ba ba bve.,7-Mar-17,209,,
17,AMZ845,Bante bad bat.,7-Mar-17,511,,
17,AMZ845,Beros bve.,7-Mar-17,511,,
17,HQD748,Beros bat ba ba ba bleo ba.,7-Mar-17,513,,
17,AMZ845,Bodio bad ba ba but bcras.,7-Mar-17,511,,
17,UIS846,Beget bad ba ba bet ba.,7-Mar-17,107,,
17,CSM507,Bnunc bve bac bmi bat bsuscipit bfelis ba.,7-Mar-17,507,,
17,CSM507,Beros bat ba ba bnibh barcu ba ba bin ba ba.,7-Mar-17,507,,
17,WXK853,Berat bat ba bcum ba bamet bleo bid bpharetra ba ba.,7-Mar-17,515,,
17,CNZ205,Bquis bat ba ba ba ba bat bsem ba ba.,7-Mar-17,629,,
17,CSM507,Bnunc bat ba bmi ba bvelit bet.,7-Mar-17,507,,
17,AMZ845,Benim bve ba bat bnam bid betiam ba bquam bcum.,7-Mar-17,511,,
17,CSM507,Borci bin ba bac.,7-Mar-17,507,,
17,CSM507,Borci bat.,7-Mar-17,507,,
17,CSM507,Bnisi bat.,7-Mar-17,507,403,400
17,MBP046,Bduis bad ba.,7-Mar-17,515,,
17,TYA561,Bodio bin ba blorem ba bcras but.,7-Mar-17,409,,
17,FIX581,Belit bmi beu bultrices ba ba ba ba best ba biaculis.,7-Mar-17,509,,
17,TYA561,Burna bin ba bdui.,7-Mar-17,409,,
17,VQD376,Bquam beu ba bpenatibus bnisl bad ba ba ba bat blectus.,7-Mar-17,511,,
17,DKW659,Bdiam bid ba ba bpretium ba bauctor ba ba.,7-Mar-17,209,,
17,CSM507,Bnisi beu.,7-Mar-17,507,,
17,DKW659,Bamet bve ba.,7-Mar-17,209,,
17,JPU485,Bante bat.,7-Mar-17,209,,
17,CQU695,Bdiam bid ba ba ba bmorbi ba bcum best ba ba.,7-Mar-17,413,,
17,HQD748,Bquam bin ba but bsed bvel bornare bcubilia beros ba ba.,7-Mar-17,513,,
17,AKC912,Belit bac ba.,7-Mar-17,517,,
17,OTS758,Bnibh bad ba.,7-Mar-17,205,,
17,TCS146,Barcu bac ba ba ba but bsit blaoreet bvulputate bante bvelit bad bhabitasse.,7-Mar-17,607,,
17,UIS846,Burna bet.,7-Mar-17,107,,
17,TCS146,Beros bin bet beros.,7-Mar-17,607,,
17,TCS146,Beget bid.,7-Mar-17,607,,
17,TCS146,Borci bid ba ba ba bconubia bmauris beleifend bet bsit but binteger.,7-Mar-17,607,,
17,LEA891,Bante beu ba ba ba ba bat bmontes bcras bdui ba beni.,7-Mar-17,209,,
17,HQD748,Bamet bin ba ba bvitae bnec bante bduis bper.,7-Mar-17,513,,
17,VQD376,Belit beu bet belit ba ba ba beget.,7-Mar-17,511,,
17,TCS146,Barcu bve.,7-Mar-17,607,,
17,TCS146,Bcras bat ba burna ba.,7-Mar-17,607,,
17,BRL042,Bdiam beu ba ba ba bnetus bnulla bad ba.,7-Mar-17,629,,
17,PRA475,Bpede bet ba benim ba bad bid bat ba bvitae ba ba beget.,7-Mar-17,173,,
17,JPU485,Bodio bmi ba best bduis berat ba ba ba but.,7-Mar-17,209,,
17,DVM139,Bnisi but baliquet.,7-Mar-17,409,,
17,TCS146,Bduis bad ba bid btempus bmassa ba benim ba ba beleifend bpede.,7-Mar-17,607,,
17,ZHB578,Bdiam but ba beu bnam bpotenti bin ba bat.,7-Mar-17,513,,
17,BRL042,Beget but beuismod ba bnon ba ba.,7-Mar-17,629,,
17,DVM139,Berat bin ba ba bhymenaeos bat ba ba bet ba bnam ba ba ba.,7-Mar-17,409,,
17,DVM139,Belit bad ba bnon bhac bamet ba ba but bdictum.,7-Mar-17,409,,
17,DVM139,Bquam bad ba bmi bhac best bmagna ba.,7-Mar-17,409,,
17,DVM139,Barcu bad.,7-Mar-17,409,,
17,WBH162,Berat bve but bmi bleo bvenenatis bsociis but.,7-Mar-17,413,,
17,DVM139,Bdiam bad bac beni ba.,7-Mar-17,409,,
17,HMX073,Bcras bac bmi ba bin borci bad bve ba ba.,7-Mar-17,629,,
17,DVM139,Bdiam bat bmi ba bnam ba bcum.,7-Mar-17,409,,
17,ZHB578,Bquis bve bac bnon.,7-Mar-17,513,,
17,LEA891,Bamet beu.,7-Mar-17,209,,
17,LEA891,Beros but ba bdui ba ba bfeugiat ba.,7-Mar-17,209,,
17,QFW209,Bpede bmi berat beros bprimis bnon betiam beleifend blacus.,7-Mar-17,507,411,400
17,HMX073,Bante bid ba burna bturpis ba bac ba bet bdis.,7-Mar-17,629,,
17,LEA891,Belit beu ba ba.,7-Mar-17,209,,
17,QFW209,Bnisi beu bviverra ba best bgravida bat ba bdolor ba ba beu ba ba.,7-Mar-17,507,,
17,QFW209,Beros bat bnibh bac bat best ba ba ba bsem ba bac.,7-Mar-17,507,,
17,QFW209,Bquam beu ba blorem barcu bnulla bvel ba ba bvarius ba.,7-Mar-17,507,,
17,HMX073,Beros bac ba baptent.,7-Mar-17,629,,
17,LEA891,Belit beu ba bad ba bprimis bnulla ba ba ba ba beu bquam btellus.,7-Mar-17,209,,
17,KQN543,Berat bid ba bmetus bvarius ba.,7-Mar-17,629,,
17,HMX073,Bnunc bve bad blacus.,7-Mar-17,629,,
17,GPJ498,Barcu bad ba bligula bhendrerit bquisque ba baenean bnetus ba ba bet.,7-Mar-17,409,,
17,GPJ498,Bante beu ba bnulla ba bdolor ba bquis ba ba ba beu ba.,7-Mar-17,409,,
17,GPJ498,Bduis but bvivamus bsociosqu bnec ba bluctus.,7-Mar-17,409,,
17,QFW209,Benim bid ba bnisi bad ba bcras bauctor bnon.,7-Mar-17,507,,
17,GPJ498,Bnibh bmi.,7-Mar-17,409,,
17,HMX073,Berat bet.,7-Mar-17,629,,
17,ZHB578,Bnibh bmi bve bleo bdis bsociis bnon.,7-Mar-17,513,,
17,HMX073,Bodio bve bid bsed bcum.,7-Mar-17,629,,
17,TPG078,Benim bat but beros bnibh bnetus bid ba ba bve bat.,7-Mar-17,629,,
17,HMX073,Bnisl beu bin ba btempus bdui ba bcum bnostra ba bpulvinar ba bnam bmauris.,7-Mar-17,629,,
17,PRA475,Beget but ba ba ba bvenenatis ba bnisl bdiam bmontes ba ba.,7-Mar-17,509,,
17,HMX073,Bamet beu ba bcum baugue ba ba beu beni bdis benim bduis bsemper ba bpellentesque bnec.,7-Mar-17,629,,
17,YPV702,Berat but.,7-Mar-17,517,,
17,ACM236,Burna bac ba ba bpurus bcongue ba bcras bac ba bultrices ba bcum.,7-Mar-17,515,,
17,YPV702,Bnisl beu ba bvel benim ba.,7-Mar-17,517,509,500
17,ACM236,Bcras bve bpede bdui ba ba ba ba bve ba bnunc ba ba.,7-Mar-17,515,,
17,UBJ603,Bpede bmi ba ba bodio bid but bduis.,7-Mar-17,409,,
17,UBJ603,Bdiam bmi beu bve.,7-Mar-17,409,,
17,TPG078,Bquam bin bmi bad ba ba bin bnon bproin bat bconsequat bneque bin bornare.,7-Mar-17,517,,
17,NUR218,Borci bac ba ba borci bmi ba ba bhymenaeos ba bamet ba bnam brutrum.,7-Mar-17,409,,
17,QJP284,Bquam bet ba.,7-Mar-17,511,,
17,TPG078,Bnunc beu ba ba bet ba.,7-Mar-17,517,501,500
17,QJP284,Benim bet.,7-Mar-17,511,,
17,HMX073,Bquam bat.,7-Mar-17,629,,
17,FIX581,Beget bat.,7-Mar-17,513,,
17,SLP187,Bodio bid ba bmagna bdui bdis ba.,7-Mar-17,629,,
17,SLP187,Borci bmi ba ba bet ba ba bmi bante ba.,7-Mar-17,629,,
17,SLP187,Bnisi beu but ba bad ba.,7-Mar-17,629,,
17,SLP187,Bdiam beu bve ba ba.,7-Mar-17,629,,
17,EUL768,Beros bin ba bdui bpurus bac bvarius ba.,7-Mar-17,629,,
17,SLP187,Bodio but ba ba ba.,7-Mar-17,629,,
17,JYL728,Bduis bet.,7-Mar-17,409,,
17,SLP187,Berat beu ba ba bquam ba bneque beget.,7-Mar-17,629,,
17,JYL728,Bquis bid ba bad.,7-Mar-17,409,,
17,SLP187,Beros bid ba bsed ba bneque.,7-Mar-17,629,,
17,SLP187,Benim bat.,7-Mar-17,629,,
17,SLP187,Bcras beu bin but binterdum ba ba.,7-Mar-17,629,,
17,SLP187,Belit beu ba bmi belit ba ba bfames.,7-Mar-17,629,,
17,XPR275,Bante bet blacinia ba brutrum bsit ba bleo.,7-Mar-17,629,,
17,GYI954,Bduis bmi ba ba bnetus ba beget ba.,7-Mar-17,629,,
17,SYB619,Bquam bmi.,7-Mar-17,607,,
17,DVM139,Bquam bac ba bdolor.,7-Mar-17,413,,
17,YTP390,Borci bet bac bquam ba bporta.,7-Mar-17,629,,
17,FHL057,Beget bmi ba bin ba bsed bleo bid ba bnam bquis.,7-Mar-17,629,,
17,FHL057,Bodio beu ba bid bquis bduis bdui.,7-Mar-17,629,,
17,FHL057,Bnisl beu ba bproin.,7-Mar-17,629,205,200
17,FHL057,Bante bac bat ba ba.,7-Mar-17,629,205,200
17,FHL057,Beget bmi ba bid ba ba bvel.,7-Mar-17,629,,
17,TUQ327,Bcras bve.,7-Mar-17,107,,
17,KSP816,Burna bac ba ba bhac ba bvel brisus ba ba.,7-Mar-17,205,101,100
17,SZP362,Bnibh bin ba bac ba ba bante bdis bnam bve bet.,7-Mar-17,507,,
17,SZP362,Burna but bve bmassa ba ba bmagna.,7-Mar-17,507,,
17,OSR174,Beros bve.,7-Mar-17,209,,
17,KSP816,Bdiam bad bat bnullam beros bid.,7-Mar-17,205,,
17,SZP362,Berat bac ba ba btortor bnam ba bnascetur beros bat ba.,7-Mar-17,507,401,400
17,SZP362,Berat bin bid bmi.,7-Mar-17,507,,
17,MVW427,Bcras bat ba bid ba ba ba.,7-Mar-17,517,,
17,SZP362,Bnibh bad ba bac bmontes.,7-Mar-17,507,,
17,SZP362,Bduis bid.,7-Mar-17,507,,
17,SZP362,Bnisl bet beros bnec bve bposuere bnulla bante bsit ba bpenatibus ba bet bsit bmetus.,7-Mar-17,507,,
17,XPR275,Bnisl bve.,7-Mar-17,517,,
17,TUQ327,Bquam bin ba bnec bporta ba ba bve beros.,7-Mar-17,509,,
17,YTP390,Berat bet.,7-Mar-17,517,,
17,FIX581,Bodio bve bad bin ba ba.,7-Mar-17,513,,
17,IBA235,Bcras bve ba bleo bcurae bet.,7-Mar-17,629,,
17,LVP764,Beros bet bmi ba ba ba but bmi ba ba bad.,7-Mar-17,205,,
17,TUQ327,Bamet bmi ba bat bmollis blacus beu.,7-Mar-17,509,,
17,SZP362,Beget but.,7-Mar-17,507,,
17,SZP362,Bdiam but ba bcurae bfacilisis bsed but bid ba bquam bid ba bligula bac bplatea ba ba.,7-Mar-17,507,,
17,OTS758,Bnisl bid barcu.,7-Mar-17,409,,
17,TUQ327,Bnisi bat ba ba.,7-Mar-17,509,,
17,FIX581,Belit beu ba bmus bnibh berat ba ba but bcras.,7-Mar-17,513,,
17,QFW209,Bnunc bet ba bsed ba bvel.,7-Mar-17,507,,
17,AHO963,Borci bid ba ba bin barcu beget bcum beni but bnatoque bsuscipit bhac ba ba.,7-Mar-17,107,,
17,PGY640,Bpede bmi ba best beni bac bsapien bvolutpat.,7-Mar-17,511,,
17,PGY640,Borci bmi beu bante ba ba bridiculus bsed bnec bad ba bet.,7-Mar-17,511,,
17,NUR218,Bquis but ba ba bve ba bin bnam but bid.,7-Mar-17,409,,
17,SVP127,Bpede bmi bve.,7-Mar-17,507,,
17,HQD748,Bpede bve ba.,7-Mar-17,517,,
17,SVP127,Bpede bat ba bmattis ba bnullam.,7-Mar-17,507,,
17,JBQ468,Borci bad ba ba bsem berat beros bnon bper.,7-Mar-17,205,,
17,SVP127,Bdiam beu but.,7-Mar-17,507,,
17,SVP127,Bduis bid ba ba ba ba ba ba ba bleo ba ba best.,7-Mar-17,507,403,400
17,SVP127,Bnibh bet bcras borci bid ba bneque beni beros ba.,7-Mar-17,507,,
17,WBH162,Beget bet.,7-Mar-17,209,,
17,SVP127,Barcu bve bad ba bhac bad ba bat.,7-Mar-17,507,,
17,SVP127,Bpede bid ba bamet ba ba.,7-Mar-17,507,,
17,SVP127,Barcu bve.,7-Mar-17,507,,
17,WBH162,Bcras bad ba ba bin ba ba ba bnascetur.,7-Mar-17,209,,
17,SVP127,Bodio bat.,7-Mar-17,507,,
17,LVP764,Berat beu.,7-Mar-17,409,,
17,IQS845,Borci bid ba bsed blorem bdiam bcurae bconsectetuer bquam bhac.,7-Mar-17,629,,
17,IQS845,Bnunc but ba bad ba bvitae beros borci bper.,7-Mar-17,629,,
17,IQS845,Burna bad bin bsit bcum but bdiam bad ba berat ba bneque bimperdiet.,7-Mar-17,629,,
17,XWK825,Burna bmi barcu bmattis ba ba belit ba.,7-Mar-17,409,,
17,XWK825,Berat bve but.,7-Mar-17,409,,
17,XWK825,Berat bve ba ba ba bhac.,7-Mar-17,409,,
17,SVP127,Bduis beu ba beu btellus.,7-Mar-17,507,,
17,SVP127,Bcras bmi ba bplatea ba.,7-Mar-17,507,,
17,SVP127,Bpede beu.,7-Mar-17,507,,
