LOC,VEH_SER_NO,INSP_COMT,TS_LOAD,FOUND_INSP_TEAM,RESP_INSP_TEAM,RESP_INSP_OPRUNT
17,RVM670,Beros beu.,6-Mar-17,107,,
17,RVM670,Borci bat ba bmi ba bid ba.,6-Mar-17,107,,
17,DBW217,Benim beu ba ba bnisl but ba ba ba bproin bnunc bodio betiam.,6-Mar-17,607,,
17,DBW217,Bduis bin bve bante blitora bper ba best bnec.,6-Mar-17,607,,
17,DBW217,Beget beu ba ba ba ba bmorbi ba burna bvitae bsem bdiam bodio bmi ba ba bvelit bac bhac.,6-Mar-17,607,,
17,RVM670,Bnibh bac baliquam ba bnon bsemper borci ba ba ba bhabitasse bsit bet bamet benim.,6-Mar-17,107,,
17,RVM670,Barcu bid bin bcum bmattis bhac bmi borci bnostra ba bnibh.,6-Mar-17,107,,
17,RVM670,Bamet bid.,6-Mar-17,107,,
17,RVM670,Barcu bet ba blacinia bnon ba.,6-Mar-17,107,,
17,RGU460,Bnunc bad bnunc bnam bat bhabitant ba ba.,6-Mar-17,607,,
17,RGU460,Bnibh bin ba.,6-Mar-17,607,,
17,FGB216,Bquis bat bquis blectus ba ba.,6-Mar-17,629,,
17,WDX548,Bdiam beu.,6-Mar-17,629,,
17,RGU460,Bamet bac bmi.,6-Mar-17,607,,
17,NHR180,Bnisi bac ba bhac bimperdiet bpede bnulla beu.,6-Mar-17,515,,
17,RHZ963,Benim bad but bvelit ba ba.,6-Mar-17,629,,
17,RHZ963,Bpede beu ba bleo.,6-Mar-17,629,,
17,IHY154,Burna bmi bve bnec bid bfeugiat bnascetur.,6-Mar-17,607,,
17,IHY154,Benim bmi ba bmi.,6-Mar-17,607,,
17,IHY154,Berat bac.,6-Mar-17,607,,
17,IHY154,Belit bve ba bid.,6-Mar-17,607,,
17,CYB497,Bquis bve.,6-Mar-17,107,,
17,CYB497,Bante bet ba bsit bnunc bnisl ba ba bante ba.,6-Mar-17,107,,
17,CYB497,Beget bid ba ba ba bin ba bsem bornare ba bhac ba ba blacinia.,6-Mar-17,107,,
17,XFK804,Barcu but.,6-Mar-17,629,,
17,CYB497,Barcu bac ba ba bmi but bsapien brhoncus ba.,6-Mar-17,107,,
17,XFK804,Bnibh bmi bac.,6-Mar-17,629,,
17,XFK804,Bnisi beu ba.,6-Mar-17,629,,
17,CYB497,Berat bve beu berat beni ba ba bfames bsed bleo.,6-Mar-17,107,,
17,XFK804,Bdiam bve beget ba ba but.,6-Mar-17,629,,
17,XFK804,Bnisl bin bve bmorbi ba ba.,6-Mar-17,629,,
17,XFK804,Bdiam bve ba bdiam bcum.,6-Mar-17,629,,
17,VCB259,Burna bad ba bid ba beu bet bmi ba bhac ba ba bfacilisis bnon ba bmagna ba ba ba ba bin.,6-Mar-17,607,,
17,XFK804,Benim bin ba bante brutrum ba bante.,6-Mar-17,629,,
17,XFK804,Bnisl bet bsodales ba bornare blacus ba ba.,6-Mar-17,629,,
17,XFK804,Bquam beu ba.,6-Mar-17,629,,
17,XFK804,Benim bid ba ba bnisi ba but.,6-Mar-17,629,,
17,TOR798,Beros bid bad bvel ba blacus but bnunc bnon bat bfusce ba bodio but ba.,6-Mar-17,607,,
17,TOR798,Berat bmi ba bmetus btempor bneque ba.,6-Mar-17,607,,
17,TOR798,Bnisl bin.,6-Mar-17,607,,
17,TOR798,Bamet bin ba.,6-Mar-17,607,,
17,TOR798,Barcu bmi bac.,6-Mar-17,607,,
17,TOR798,Bdiam bin but bat beget ba ba but.,6-Mar-17,607,,
17,TOR798,Bcras bat.,6-Mar-17,607,,
17,XEG792,Bodio bet ba bmagna ba bmalesuada ba.,6-Mar-17,629,,
17,XEG792,Bodio bmi ba bnibh bin beu bnulla ba burna ba.,6-Mar-17,629,,
17,XEG792,Borci bin ba bmi ba bfringilla ba bnibh ba.,6-Mar-17,629,205,200
17,XEG792,Bquam bid.,6-Mar-17,629,,
17,XEG792,Berat bve ba but ba bad bsit beu ba bet ba ba.,6-Mar-17,629,,
17,JHY927,Benim bmi ba bmus bsodales bin.,6-Mar-17,629,,
17,XEG792,Berat but bat.,6-Mar-17,629,,
17,JHY927,Bdiam bet bcras bquis.,6-Mar-17,629,,
17,JHY927,Bdiam but.,6-Mar-17,629,,
17,JHY927,Bquis bid bat barcu bet ba bmontes.,6-Mar-17,629,,
17,JHY927,Benim bmi but ba.,6-Mar-17,629,,
17,JHY927,Benim bin barcu.,6-Mar-17,629,,
17,XOG241,Bnisl bid beu ba ba bmagna bin.,6-Mar-17,107,,
17,XOG241,Bnunc bid ba bnibh ba.,6-Mar-17,107,,
17,NGC871,Bnisi bin bmi bpurus ba bdiam bfusce bat baptent bvel.,6-Mar-17,509,,
17,XOG241,Bnunc bac ba bat.,6-Mar-17,107,,
17,NGC871,Bodio bat.,6-Mar-17,509,,
17,BTO107,Borci bet ba ba bat ba ba barcu bve ba.,6-Mar-17,629,,
17,NGC871,Barcu bac ba bdis bcommodo.,6-Mar-17,509,,
17,XOG241,Beget bmi ba bac bat bfelis ba.,6-Mar-17,107,,
17,NGC871,Bcras bat ba ba bac bduis beni bve beu bac ba btempor.,6-Mar-17,509,,
17,BTO107,Bquis bad ba.,6-Mar-17,629,,
17,NGC871,Bquis bad bnunc blitora bmorbi bet.,6-Mar-17,509,,
17,BTO107,Bnisl beu ba.,6-Mar-17,629,,
17,XOG241,Bnibh bac.,6-Mar-17,107,,
17,BTO107,Bnisl bve ba ba ba bac bper.,6-Mar-17,629,,
17,BTO107,Bante bat ba ba ba bfelis bconvallis bnam bve bac but bnec.,6-Mar-17,629,,
17,BTO107,Bamet bin bnisi ba ba beu.,6-Mar-17,629,,
17,KHN863,Bduis bad ba best bnullam bdis bvelit bnonummy.,6-Mar-17,513,209,200
17,KHN863,Bante beu ba best bfelis berat.,6-Mar-17,513,,
17,BTO107,Beros bin bposuere betiam berat bcras bsem.,6-Mar-17,629,205,200
17,BTO107,Bquis bmi bad bcras ba ba.,6-Mar-17,629,,
17,BTO107,Borci bat ba beu bsed bcongue bat ba bcras ba ba ba.,6-Mar-17,629,,
17,PXD385,Bquam beu.,6-Mar-17,629,,
17,PXD385,Berat bve ba bin bmagnis bpraesent bet bcongue ba bnec bnisi bamet bdis ba bnisl bvarius ba.,6-Mar-17,629,,
17,PXD385,Bquam bac ba ba bmetus ba.,6-Mar-17,629,,
17,PXD385,Bdiam bid ba bvitae bnunc.,6-Mar-17,629,,
17,PXD385,Bodio beu ba ba.,6-Mar-17,629,,
17,PXD385,Bduis but beu ba beu bdis bsit.,6-Mar-17,629,,
17,PXD385,Bquam bat.,6-Mar-17,629,,
17,PXD385,Bquis bve bmi.,6-Mar-17,629,,
17,PXD385,Bdiam beu benim bat ba bornare bposuere ba bve bmi bornare ba bvulputate ba belit ba.,6-Mar-17,629,,
17,EGK921,Borci but ba beu bmi.,6-Mar-17,413,,
17,PYH561,Bnisi bve bad bvel bac bnonummy bnisl ba ba ba ba.,6-Mar-17,409,,
17,YTG326,Bnisl beu bnisi bcum.,6-Mar-17,517,513,500
17,TFU306,Beget bet ba ba bdui.,6-Mar-17,507,,
17,YTG326,Burna bid ba baugue ba bcurae ba bvestibulum bid bet.,6-Mar-17,517,,
17,TFU306,Bnibh bmi ba bnulla bin bquis beros beni ba beuismod ba bproin ba ba ba bsit ba.,6-Mar-17,507,,
17,TFU306,Bpede bad ba.,6-Mar-17,507,,
17,SLP187,Borci but bposuere bmorbi ba ba bper ba.,6-Mar-17,409,,
17,TFU306,Bdiam beu ba ba bmi bturpis ba bac bgravida.,6-Mar-17,507,,
17,SLP187,Benim bmi.,6-Mar-17,409,,
17,TFU306,Beros bat ba ba bmontes bac beni bnon btempor.,6-Mar-17,507,,
17,SLP187,Bnisi beu ba bat ba.,6-Mar-17,409,,
17,TFU306,Bquis bmi.,6-Mar-17,507,,
17,TFU306,Borci but ba bpraesent berat beleifend.,6-Mar-17,507,,
17,TFU306,Bnisl bin bconubia bfacilisi bvel ba.,6-Mar-17,507,,
17,EPB160,Belit bac ba.,6-Mar-17,409,,
17,EPB160,Bdiam beu ba ba ba.,6-Mar-17,409,,
17,EKW143,Bquam bid barcu bclass bnam bquam ba bvitae bmattis bclass.,6-Mar-17,517,505,500
17,QMF308,Bduis but ba bsem bac btempor.,6-Mar-17,513,,
17,EKW143,Bcras bmi benim ba ba btellus ba.,6-Mar-17,517,505,500
17,DWK315,Bnibh but ba ba bnisl ba ba.,6-Mar-17,503,,
17,SGN329,Barcu but ba borci ba ba.,6-Mar-17,409,,
17,FUR610,Beros bet bve ba.,6-Mar-17,517,513,500
17,QMF308,Bquam bat ba bfelis bipsum bpellentesque begestas.,6-Mar-17,513,,
17,YKL520,Bodio bve ba blibero bdui bipsum bturpis ba.,6-Mar-17,511,,
17,YKZ247,Bpede bac bve ba ba bhac ba bgravida.,6-Mar-17,209,,
17,BHK490,Bamet but.,6-Mar-17,413,,
17,YKL520,Burna bat ba borci bnam ba ba.,6-Mar-17,511,,
17,EMV512,Berat beu.,6-Mar-17,517,503,500
17,YKL520,Bnunc bat ba bcras ba ba bve bad.,6-Mar-17,511,,
17,GYV645,Bnisl bad ba ba ba.,6-Mar-17,515,,
17,SVK948,Bquam bad.,6-Mar-17,629,,
17,QMF308,Bpede beu ba bornare bdiam bac ba ba ba bve bauctor ba ba.,6-Mar-17,513,,
17,GYV645,Beget bet ba ba bipsum btempor ba ba bsed ba bdui.,6-Mar-17,515,,
17,QMF308,Bodio beu ba bet ba bvel ba ba but bnam.,6-Mar-17,513,,
17,YKL520,Borci bin.,6-Mar-17,511,,
17,EMV512,Bodio bid.,6-Mar-17,517,,
17,SVK948,Bante bac bad ba.,6-Mar-17,629,,
17,QMF308,Belit beu.,6-Mar-17,513,,
17,YKL520,Berat bac beu bmus bat.,6-Mar-17,511,,
17,EMV512,Burna bat bad binterdum ba best bscelerisque ba bac btempor.,6-Mar-17,517,309,300
17,KWT597,Bcras but ba bmattis ba.,6-Mar-17,507,413,400
17,UJB305,Bcras bac ba bve bmi best bcum bmassa ba bpede ba bvel.,6-Mar-17,509,,
17,KWT597,Berat bin ba ba bsit best bmi brutrum bper.,6-Mar-17,507,,
17,KWT597,Berat beu bac ba ba but bquam ba.,6-Mar-17,507,,
17,LWK693,Bnunc bmi bquis ba bper bvelit.,6-Mar-17,409,,
17,LWK693,Bamet bac.,6-Mar-17,409,,
17,KWT597,Bamet beu.,6-Mar-17,507,,
17,KWT597,Bdiam bat bac ba ba ba ba blacus bve ba bmus.,6-Mar-17,507,,
17,KWT597,Burna but.,6-Mar-17,507,,
17,UYZ958,Bnisi bad ba ba bdis but bproin but ba bmattis ba.,6-Mar-17,413,,
17,KWT597,Benim but bve bnec bid bpede blibero ba binterdum ba ba ba.,6-Mar-17,507,,
17,KWT597,Bnisl bid ba beu ba beros bmus ba bvel bsit ba bnam belit ba.,6-Mar-17,507,,
17,KWT597,Beros bad ba bac bve bdolor.,6-Mar-17,507,,
17,YKZ247,Bnibh bmi bve bleo bve bposuere.,6-Mar-17,209,,
17,GMS924,Bamet bad ba bturpis bnec bid.,6-Mar-17,205,,
17,GMS924,Bnisl bac ba bdis ba borci bat ba bsit bdolor bcongue.,6-Mar-17,205,,
17,QFB620,Bnisi beu ba ba burna ba bturpis bvarius bsollicitudin.,6-Mar-17,511,,
17,QFB620,Bduis beu ba bfermentum bhac bet ba.,6-Mar-17,511,,
17,QVS392,Belit bet ba bnec bquis ba.,6-Mar-17,409,,
17,HTI974,Belit bac ba bin bcum bnam baptent bporta ba bid bporta bmi bquam ba.,6-Mar-17,629,,
17,WMR075,Bnunc bin ba ba beu ba bac ba.,6-Mar-17,517,,
17,HTI974,Bcras beu.,6-Mar-17,629,,
17,ULN810,Bpede bac.,6-Mar-17,509,,
17,ULN810,Barcu bid bet bve baugue ba ba.,6-Mar-17,509,,
17,HTI974,Bquam bac ba ba ba bin bsed ba ba bmi ba bfames barcu bmalesuada.,6-Mar-17,629,,
17,WMR075,Bquis bac ba ba beu bpede bodio bcondimentum btempus.,6-Mar-17,517,505,500
17,WMR075,Barcu bat ba bnam.,6-Mar-17,517,505,500
17,BEC741,Burna bmi ba.,6-Mar-17,513,,
17,ULN810,Bnisi bin bnunc bnec ba ba baptent.,6-Mar-17,509,,
17,ODX806,Burna beu ba bcum ba bmi bsemper.,6-Mar-17,629,,
17,YKZ247,Bquis beu ba bdui btaciti beu ba bneque bcongue ba ba ba beuismod.,6-Mar-17,209,,
17,ULN810,Bnibh bid blacinia bquam ba.,6-Mar-17,509,,
17,PSZ241,Bante bat ba bmus.,6-Mar-17,511,,
17,TGJ401,Bdiam bid ba bsem ba bipsum ba bvelit bprimis.,6-Mar-17,507,,
17,WMR075,Bnisl bid.,6-Mar-17,517,401,400
17,ODX806,Bquis bmi ba ba.,6-Mar-17,629,,
17,TGJ401,Borci bac bblandit betiam ba bsed ba ba bipsum.,6-Mar-17,507,,
17,ULN810,Benim bid.,6-Mar-17,509,,
17,BEC741,Bduis bat ba ba ba ba ba ba.,6-Mar-17,513,,
17,PSZ241,Bquam bmi ba ba.,6-Mar-17,511,,
17,TGJ401,Benim bet ba.,6-Mar-17,507,,
17,BEC741,Benim bid ba bdui ba bsodales bdui bvelit bluctus bmagna.,6-Mar-17,513,,
17,PSZ241,Barcu bve ba btortor blacinia ba best bnisl burna bcras bleo bad bet.,6-Mar-17,511,,
17,ULN810,Burna bmi.,6-Mar-17,509,,
17,TGJ401,Belit bid ba bante ba ba ba bcurae bnon bnec.,6-Mar-17,507,,
17,TGJ401,Borci bet ba bsit.,6-Mar-17,507,,
17,TGJ401,Bcras beu.,6-Mar-17,507,,
17,PGN796,Bante but ba ba blitora bdonec ba.,6-Mar-17,517,,
17,QME682,Bnibh bin ba ba ba.,6-Mar-17,205,,
17,YKL520,Bquam bid bsodales.,6-Mar-17,515,503,500
17,TGJ401,Bnunc but bad bvel ba.,6-Mar-17,507,401,400
17,TGJ401,Beget bin ba ba ba.,6-Mar-17,507,,
17,ULN810,Bnibh bmi ba ba ba but.,6-Mar-17,509,,
17,TGJ401,Bpede bac ba bad bfames bsodales beni ba ba barcu ba ba ba.,6-Mar-17,507,,
17,ULN810,Berat bet.,6-Mar-17,509,,
17,ULN810,Bduis bad ba bet.,6-Mar-17,509,,
17,WDM529,Bquis bve ba bmattis ba btempus beu ba bvel ba bleo.,6-Mar-17,409,,
17,PGN796,Bamet but.,6-Mar-17,517,,
17,EQK798,Berat bid ba bante bnetus bdui bnec.,6-Mar-17,409,,
17,YKL520,Bdiam bmi ba ba bjusto.,6-Mar-17,515,507,500
17,JDY852,Bquis bin ba best.,6-Mar-17,209,,
17,PYH561,Bamet beu ba ba ba but.,6-Mar-17,413,,
17,YKL520,Bnunc bat ba bsem ba bnunc ba ba bmi.,6-Mar-17,515,503,500
17,UFV140,Berat bad ba bnullam bmus ba ba bduis.,6-Mar-17,629,,
17,JDY852,Bdiam bve bmi bsagittis ba bvel bfames bpotenti.,6-Mar-17,209,,
17,BDV695,Benim bad.,6-Mar-17,629,,
17,PGN796,Bnunc bet bin ba bmetus bmolestie ba ba bparturient.,6-Mar-17,517,,
17,BDV695,Beget bid ba ba ba ba ba bfermentum ba bin.,6-Mar-17,629,,
17,BDV695,Beros but bid bnec bvivamus bipsum beros ba ba ba bmagna bvehicula blorem.,6-Mar-17,629,,
17,PGN796,Bdiam bac ba ba ba.,6-Mar-17,517,,
17,KHN863,Barcu bad ba.,6-Mar-17,517,505,500
17,OIF375,Bnisl bac ba bper bdiam beros bnam ba bleo ba bnam ba bvulputate bmetus.,6-Mar-17,507,,
17,OIF375,Borci bve ba bin berat ba bfringilla.,6-Mar-17,507,,
17,LYX953,Bcras bmi ba ba bmetus bve bet ba ba ba bfelis.,6-Mar-17,107,,
17,TLW135,Bquis bet ba brisus bmetus beu ba ba ba.,6-Mar-17,517,,
17,YPV702,Bquam bad ba bve bsagittis ba ba ba ba bve bleo.,6-Mar-17,409,,
17,OIF375,Bnisl bid binteger baugue.,6-Mar-17,507,,
17,OIF375,Bquis bve ba bmontes beros ba.,6-Mar-17,507,,
17,FNG604,Bnisl bac bve bsit bdui burna.,6-Mar-17,509,,
17,OIF375,Burna bid.,6-Mar-17,507,,
17,FNG604,Bcras bin ba bsemper bper ba berat ba.,6-Mar-17,509,,
17,OIF375,Bante bet ba ba ba ba ba ba ba bnam.,6-Mar-17,507,,
17,OIF375,Bquam bin bet bsem bquisque bet.,6-Mar-17,507,,
17,QFB620,Bduis bad ba.,6-Mar-17,515,,
17,OIF375,Bcras bin.,6-Mar-17,507,401,400
17,YNQ647,Bduis but ba bturpis ba ba.,6-Mar-17,629,,
17,LYX953,Benim bac ba ba bet beni binteger.,6-Mar-17,107,,
17,TJV623,Bquis but bin bmus ba ba btempor ba bmollis bid.,6-Mar-17,513,,
17,OIF375,Bquam but beu bnam bac ba bvel baugue beuismod bleo ba bpharetra beget bac ba.,6-Mar-17,507,,
17,XYI250,Bcras beu bduis best bat barcu ba bdolor berat borci belit bat ba bsit ba.,6-Mar-17,209,,
17,OIF375,Barcu bat ba.,6-Mar-17,507,,
17,TLW135,Bodio but.,6-Mar-17,517,,
17,YNQ647,Barcu bin.,6-Mar-17,629,,
17,XYI250,Bamet bmi ba baptent.,6-Mar-17,209,,
17,QFB620,Beget but bet ba ba bdui blibero ba borci bcurae bpellentesque.,6-Mar-17,515,503,500
17,YNQ647,Bnisl bmi ba ba ba beni bhendrerit bauctor bmus blorem bmauris bid bfelis bet.,6-Mar-17,629,,
17,YTG326,Bnunc bad ba bnunc.,6-Mar-17,629,,
17,CQO892,Bodio bet ba bper ba bquam ba ba ba bquisque.,6-Mar-17,511,,
17,KIM819,Bdiam bat.,6-Mar-17,517,503,500
17,CQO892,Bpede bac.,6-Mar-17,511,,
17,KIM819,Burna but burna ba bcras ba betiam.,6-Mar-17,517,507,500
17,CQO892,Bdiam but ba ba bcubilia btaciti ba bnec bmi blorem.,6-Mar-17,511,,
17,NGC871,Belit bve.,6-Mar-17,513,,
17,KIM819,Bamet bve ba bsem bligula bclass bhac.,6-Mar-17,517,501,500
17,CQO892,Bnunc bad ba ba bsed baenean betiam.,6-Mar-17,511,,
17,LWK693,Bnisl bve ba bdiam ba ba bpede ba betiam bquam bad bid ba ba btortor ba.,6-Mar-17,413,,
17,KIM819,Benim bad ba ba ba ba ba ba.,6-Mar-17,517,,
17,CQO892,Bnisl bad.,6-Mar-17,511,,200
17,GDU671,Bnunc bad ba blectus ba bnostra beu bdiam btempor bper bsit ba bad bsociis.,6-Mar-17,409,,
17,CQO892,Belit beu bmi ba ba bnon bmi.,6-Mar-17,511,,
17,CQO892,Bnisi but.,6-Mar-17,511,,
17,NGC871,Bduis bad bcras bcurae ba bsuscipit ba.,6-Mar-17,513,209,200
17,CQO892,Borci bmi ba ba ba bsociis benim ba.,6-Mar-17,511,,
17,GMS924,Bante bid ba bfaucibus ba bnon.,6-Mar-17,409,,
17,BHK490,Bduis but ba brutrum ba ba bnon bvenenatis btortor bat ba beu ba.,6-Mar-17,209,,
17,YKZ247,Bamet bmi bet bdui ba ba.,6-Mar-17,509,,
17,YKZ247,Bnibh beu.,6-Mar-17,509,,
17,YKZ247,Bnunc bet ba.,6-Mar-17,509,,
17,QVS392,Burna bac bve beu.,6-Mar-17,413,,
17,ELI075,Belit bat.,6-Mar-17,409,,
17,QMF308,Bnunc bet ba ba baptent bper bet ba ba.,6-Mar-17,517,505,500
17,NVM832,Beros bve ba bmassa bac bauctor ba ba.,6-Mar-17,507,413,400
17,NVM832,Bamet bid ba bmollis ba bmi ba bsed bat ba.,6-Mar-17,507,,
17,NHR180,Bnunc bad.,6-Mar-17,629,,
17,NHR180,Burna bmi bin ba bneque bve ba bmi ba bvelit bdonec bac baenean.,6-Mar-17,629,,
17,NVM832,Bcras but bat ba bet btellus burna.,6-Mar-17,507,,
17,DWK315,Bnibh bac ba bad bmagnis ba ba bin ba.,6-Mar-17,511,,
17,NHR180,Bnibh bad ba bleo bsem.,6-Mar-17,629,,
17,NVM832,Bdiam bmi ba but ba.,6-Mar-17,507,,
17,DWK315,Bquis bid.,6-Mar-17,511,,
17,NVM832,Bante beu.,6-Mar-17,507,,
17,NVM832,Bnisl but.,6-Mar-17,507,,
17,DWK315,Belit bid ba ba.,6-Mar-17,511,,
17,TLW135,Bnisl beu bad ba bfames barcu bmattis.,6-Mar-17,517,,
17,UYZ958,Bquam bve ba.,6-Mar-17,209,,
17,NVM832,Borci bid bac ba ba ba.,6-Mar-17,507,,
17,DWK315,Beros bac ba bad bsem ba ba bimperdiet bcum bid bsodales ba.,6-Mar-17,511,,
17,NVM832,Bnisl bet bad bac bduis bpede bmagnis ba bnam bsem.,6-Mar-17,507,,
17,NVM832,Bquis bac ba ba.,6-Mar-17,507,,
17,YLB740,Bpede bve ba barcu ba bve ba.,6-Mar-17,517,,
17,DWK315,Beget bat ba bve bper bpurus baptent.,6-Mar-17,511,,
17,NVM832,Bpede bet bac bcras btortor ba ba ba bdui ba ba.,6-Mar-17,507,,
17,YLB740,Bpede bve.,6-Mar-17,517,,
17,YLB740,Belit bat.,6-Mar-17,517,,
17,YLB740,Bodio bac bin betiam bat bcongue bmetus ba bnam ba bmetus bante belit bin.,6-Mar-17,517,,
17,SVK948,Bduis bac ba bdictum ba ba bdictum bsit ba btaciti btincidunt bblandit.,6-Mar-17,517,,
17,EWM290,Bquis bet ba bin ba bmi bin bac bpede.,6-Mar-17,629,,
17,JLD084,Burna but bin ba.,6-Mar-17,509,,
17,EWM290,Bante bid.,6-Mar-17,629,,
17,MBF976,Berat bin ba ba ba ba bporttitor bpede bac ba ba ba.,6-Mar-17,507,,
17,MBF976,Bduis bac ba ba ba bleo ba.,6-Mar-17,507,,
17,BEC741,Bpede bad ba ba ba bvelit bve bpede bleo ba ba bdis.,6-Mar-17,517,505,500
17,MBF976,Bnisi beu ba ba.,6-Mar-17,507,,
17,PSZ241,Borci bid baliquam bipsum ba bnostra bporttitor baliquet ba.,6-Mar-17,515,,
17,MBF976,Bnisi bmi.,6-Mar-17,507,,
17,JLD084,Bquam bid ba bad ba ba.,6-Mar-17,509,,
17,PSZ241,Borci but ba bcras bnec ba bhac ba baliquam bpotenti.,6-Mar-17,515,,
17,MBF976,Bnisl bve ba bvarius ba bve ba bet bhac bet beu bin ba.,6-Mar-17,507,,
17,MBF976,Bquam bid bin ba bdictum ba bsapien barcu bac ba bid brisus.,6-Mar-17,507,,
17,PSZ241,Bnunc but ba bante.,6-Mar-17,515,,
17,MBF976,Borci bid ba ba bet bve bdolor bmagnis bfames bsem bdui.,6-Mar-17,507,403,400
17,PSZ241,Bcras beu.,6-Mar-17,515,503,500
17,MBF976,Bamet bmi bac bper ba ba ba berat bve ba bmattis ba.,6-Mar-17,507,,
17,PSZ241,Bcras bid ba ba bvel bnam bquam.,6-Mar-17,515,,
17,MBF976,Belit bat bve benim ba ba.,6-Mar-17,507,,
17,YPV702,Beget bad.,6-Mar-17,409,,
17,TFU306,Bante bat ba bsit bac beuismod.,6-Mar-17,511,,
17,YPV702,Bamet bve ba baliquam ba bhac ba ba ba.,6-Mar-17,409,,
17,EPB160,Bnunc bin bet ba ba ba baliquet.,6-Mar-17,209,,
17,TFU306,Benim bat ba bsapien bante bhac bmus blacus ba bsollicitudin best.,6-Mar-17,511,,
17,EPB160,Bquam beu.,6-Mar-17,209,,
17,TFU306,Benim bet ba bsem bcursus bfusce bve ba ba bvenenatis.,6-Mar-17,511,,
17,YPV702,Bquis bet ba.,6-Mar-17,409,,
17,LNY482,Borci bmi ba bac bsit bipsum bposuere bdis bnetus ba bodio bet ba.,6-Mar-17,513,209,200
17,UFV140,Beget bac ba bet ba btellus.,6-Mar-17,517,,
17,UJB305,Barcu bet ba bnam.,6-Mar-17,513,209,200
17,UFV140,Bdiam but bin bduis.,6-Mar-17,517,,
17,LWK693,Belit bac ba borci bquis bhac ba.,6-Mar-17,209,,
17,UFV140,Bnibh bac ba ba ba bdis beget bpede bcum ba.,6-Mar-17,517,405,400
17,UFV140,Berat bmi.,6-Mar-17,517,,
17,CQO892,Bante bat ba ba bet ba bsed bat.,6-Mar-17,515,209,200
17,CQO892,Belit bin beuismod ba bve bligula.,6-Mar-17,515,,
17,JDY852,Bante bet bve beros bdui.,6-Mar-17,509,,400
17,JDY852,Bnisi bet bad bmus bfacilisis brutrum bad.,6-Mar-17,509,,
17,EGK921,Belit beu ba.,6-Mar-17,507,401,400
17,LWK693,Bnibh beu ba but ba beni bodio ba.,6-Mar-17,209,,
17,JDY852,Barcu bmi bad ba.,6-Mar-17,509,,
17,PGN796,Bcras bmi bduis beu ba ba.,6-Mar-17,629,,
17,EGK921,Bcras bid bat bsem beu bin bante beni ba ba.,6-Mar-17,507,,
17,EGK921,Bquam bac ba bsit benim ba ba bdis.,6-Mar-17,507,,
17,JDY852,Bante bmi.,6-Mar-17,509,,
17,PGN796,Bnisl bet ba ba bve betiam ba.,6-Mar-17,629,,
17,TJV623,Bduis bat ba.,6-Mar-17,517,505,500
17,EGK921,Beget bac bat ba bvarius bve.,6-Mar-17,507,,
17,BEM390,Bnibh bat bante ba bdis ba.,6-Mar-17,409,,
17,EGK921,Bnibh bin.,6-Mar-17,507,,
17,PGN796,Berat bad ba ba ba bsit.,6-Mar-17,629,,
17,KWT597,Beget bin bposuere ba bsollicitudin.,6-Mar-17,511,,
17,EGK921,Benim bin.,6-Mar-17,507,,
17,EGK921,Borci bin bid bmus bper bprimis benim bnam.,6-Mar-17,507,,
17,PGN796,Benim bmi ba bamet ba bcongue ba ba bad bhac.,6-Mar-17,629,,
17,KWT597,Burna bin ba.,6-Mar-17,511,,
17,EGK921,Bpede bat ba ba beget.,6-Mar-17,507,,
17,PGN796,Bante beu ba ba ba ba bid bin betiam ba bdis ba ba ba ba ba bvel barcu.,6-Mar-17,629,,
17,DFZ024,Bamet bet bat ba brisus.,6-Mar-17,205,,
17,SLP187,Borci bet.,6-Mar-17,409,,
17,EGK921,Belit bve.,6-Mar-17,507,,
17,TJV623,Bnibh beu.,6-Mar-17,517,505,500
17,SLP187,Bquis bve ba ba ba beu ba ba ba bdignissim bconsectetuer bnisl beni.,6-Mar-17,409,,
17,EGK921,Barcu bid.,6-Mar-17,507,,
17,EGK921,Bduis bve ba but bmassa.,6-Mar-17,507,409,400
17,SLP187,Borci bve ba bet ba ba bfames blectus bdolor.,6-Mar-17,409,,
17,SLP187,Bnunc bac borci belit bsed.,6-Mar-17,409,,
17,SLP187,Bduis bat.,6-Mar-17,409,,
17,SLP187,Bduis bmi bgravida blorem ba bper ba ba bmi bet ba.,6-Mar-17,409,,
17,JDY852,Belit bat ba bmus ba bporta ba.,6-Mar-17,509,,
17,GMS924,Bnibh bmi ba bduis baugue bid bve.,6-Mar-17,413,,
17,UJB305,Bnibh bat ba.,6-Mar-17,513,209,200
17,QVS392,Bodio bin ba btaciti.,6-Mar-17,209,,
17,EQK798,Bquis bin ba baugue bve ba ba.,6-Mar-17,205,,
17,TLW135,Borci beu ba ba bnatoque blectus btorquent ba bdui bnibh borci bdis ba bvel bdis.,6-Mar-17,629,,
17,ULN810,Bcras bve ba ba.,6-Mar-17,513,,
17,TLW135,Bquam bac bdiam bnunc bhac but bmi.,6-Mar-17,629,,
17,TIP072,Bnibh bin ba ba beu brutrum ba bante ba bdui.,6-Mar-17,517,,
17,TIP072,Bnisl bad bmi bclass ba bac ba ba bdictum.,6-Mar-17,517,,
17,SLP187,Bnisl bad ba ba ba bper benim.,6-Mar-17,409,,
17,TGS974,Belit bat ba blorem binterdum bmagna bmattis ba bpurus bduis bquis bsit bin bmi bmassa btempus ba ba.,6-Mar-17,205,,
17,XYI250,Burna bve bet bduis ba ba ba best baliquet.,6-Mar-17,507,413,400
17,QFB620,Beros bad ba ba bin beni bamet baenean ba.,6-Mar-17,629,,
17,RZW691,Beros bin ba ba ba ba ba ba.,6-Mar-17,517,,
17,XYI250,Beros bac bpotenti bdonec bduis bdiam ba bpotenti.,6-Mar-17,507,,
17,SGN329,Barcu bid ba.,6-Mar-17,409,,
17,HMX073,Bnibh bac bid bmus binceptos bet bplatea bduis ba baptent ba ba bat baliquam bporta ba.,6-Mar-17,209,,
17,XYI250,Bduis but ba ba ba bpede.,6-Mar-17,507,,
17,XYI250,Bodio beu ba but bve bin bmorbi ba beni ba.,6-Mar-17,507,,
17,HMX073,Borci but.,6-Mar-17,209,,
17,XYI250,Belit bac ba ba bcum blitora bneque.,6-Mar-17,507,,
17,XYI250,Bante bmi ba bsit ba ba bhac bnec bornare but ba ba.,6-Mar-17,507,,
17,TGJ401,Bcras beu ba ba bin bve.,6-Mar-17,511,,
17,XYI250,Bquis but ba.,6-Mar-17,507,,
17,HMX073,Benim but ba bat bcum ba ba ba bfusce ba.,6-Mar-17,209,,
17,XYI250,Bpede bac.,6-Mar-17,507,,
17,TGJ401,Beros bet.,6-Mar-17,511,,
17,XYI250,Bpede but ba ba.,6-Mar-17,507,,
17,TGJ401,Barcu bid.,6-Mar-17,511,,
17,ITO673,Benim bid ba ba beu bsit bleo ba bamet ba bper.,6-Mar-17,413,,
17,XYI250,Burna bac.,6-Mar-17,507,409,400
17,DWK315,Bduis beu ba bhac ba ba ba ba bhabitasse ba bnisl ba ba bat ba bat baliquet.,6-Mar-17,515,,
17,DWK315,Bduis bet bve beni ba bnullam.,6-Mar-17,515,,
17,EMV512,Borci bet bac.,6-Mar-17,629,,
17,DWK315,Borci bac brhoncus ba bve bnetus bpotenti best ba bat.,6-Mar-17,515,,
17,ITO673,Bodio bve.,6-Mar-17,413,,
17,WDM529,Benim bid.,6-Mar-17,209,,
17,TCS146,Bnisi bin ba bat bad.,6-Mar-17,409,,
17,TCS146,Bnibh bin bid ba ba ba ba btaciti bin baptent blorem ba bve bvel.,6-Mar-17,409,,
17,BHK490,Beget bin ba bnostra ba bconvallis bac ba barcu ba ba bat.,6-Mar-17,509,,
17,RTW145,Bante bid bet best ba.,6-Mar-17,517,,
17,NHR180,Berat bin ba ba ba bultricies bsollicitudin.,6-Mar-17,607,,
17,BHK490,Bpede beu bve ba ba ba.,6-Mar-17,509,,
17,JFE913,Bpede bad ba ba bvel ba blobortis bnibh ba ba ba.,6-Mar-17,107,,
17,BHK490,Bduis bet.,6-Mar-17,509,,
17,WMR075,Bcras bin ba ba ba ba bmassa bgravida bnec ba.,6-Mar-17,517,409,400
17,UYZ958,Bnunc bmi bviverra ba bsollicitudin borci bsed ba ba beros bet ba bac bpharetra.,6-Mar-17,507,407,400
17,UYZ958,Beget bin ba bsociis belementum ba bmagnis bhac bfelis.,6-Mar-17,507,,
17,NGC871,Bnunc bmi.,6-Mar-17,517,505,500
17,UYZ958,Bduis bat ba ba bnonummy ba bvel.,6-Mar-17,507,,
17,FNG604,Bquam bat ba bmus brutrum bnisi bac ba.,6-Mar-17,513,,
17,UYZ958,Bnisl beu ba bper ba.,6-Mar-17,507,,
17,OQA530,Berat but.,6-Mar-17,409,,
17,UYZ958,Beget bad ba ba bnetus bet ba.,6-Mar-17,507,,
17,XSF309,Borci bet ba.,6-Mar-17,209,,
17,EKW143,Beros but.,6-Mar-17,629,,
17,EKW143,Bpede bve.,6-Mar-17,629,,
17,BHK490,Berat bat ba ba best ba btorquent.,6-Mar-17,509,,
17,JFE913,Bdiam bve bmi bcum bve ba.,6-Mar-17,107,,
17,BHK490,Burna bin ba but bnisl ba.,6-Mar-17,509,,
17,QMF308,Bnisi bve ba ba bnisi bvel ba binteger bnec bid.,6-Mar-17,629,,
17,QMF308,Bquis bet bamet bcum baptent bdiam but ba bnunc bve ba ba ba bconvallis bvel.,6-Mar-17,629,,
17,FNG604,Barcu beu bin but bmi ba bnec blitora.,6-Mar-17,513,209,200
17,DFZ024,Benim but ba.,6-Mar-17,409,,
17,TFU306,Beros bad ba ba ba bat baenean.,6-Mar-17,515,,
17,FNG604,Bquam bmi.,6-Mar-17,513,209,200
17,DFZ024,Beros bad bin.,6-Mar-17,409,,
17,OIF375,Benim bat bgravida bfacilisi bmus ba bmus bet bat ba ba ba burna.,6-Mar-17,511,,
17,TFU306,Borci bin ba bleo blibero bnunc but bet bduis ba bdignissim bdapibus ba.,6-Mar-17,515,,
17,OIF375,Bodio bet ba.,6-Mar-17,511,,400
17,TFU306,Bcras bmi ba bcum.,6-Mar-17,515,503,500
17,OIF375,Beget bet benim ba ba ba.,6-Mar-17,511,,
17,NGC871,Belit but bad bmassa begestas best bat baptent bnisl ba ba bhac bmus.,6-Mar-17,517,509,500
17,FTO836,Borci bin bad bet borci.,6-Mar-17,413,,
17,LNY482,Berat beu.,6-Mar-17,517,505,500
17,NHR180,Bquis bet.,6-Mar-17,607,,
17,UYZ958,Borci bad bve bhac bmus.,6-Mar-17,507,,
17,UYZ958,Beros bve bcubilia bdiam ba bdolor.,6-Mar-17,507,,
17,TNY179,Belit but ba.,6-Mar-17,509,,
17,JFE913,Beros bin ba.,6-Mar-17,107,,
17,TNY179,Beros beu.,6-Mar-17,509,,
17,PSZ241,Bdiam bve ba bnullam ba ba blitora.,6-Mar-17,629,,
17,GYV645,Bnisi bin beu ba bviverra blectus ba ba bdiam.,6-Mar-17,517,,
17,NHR180,Beros but bmi bnam bcurae bet.,6-Mar-17,607,,
17,PSZ241,Beget bat ba bin bdonec ba beni ba beni.,6-Mar-17,629,,
17,GMS924,Bquam bin ba bfames bpellentesque bante.,6-Mar-17,209,,
17,LNY482,Bnibh bin ba bcurae.,6-Mar-17,517,513,500
17,TNY179,Beros bid ba bamet bin ba ba bdui bauctor but belit.,6-Mar-17,509,,
17,GMS924,Burna bet ba ba.,6-Mar-17,209,,
17,EQK798,Bodio but ba bante ba ba bcurae bfusce bid bet.,6-Mar-17,409,,
17,TNY179,Borci beu blaoreet ba btempus bmus bcommodo bin ba.,6-Mar-17,509,,
