LOC,VEH_SER_NO,INSP_COMT,TS_LOAD,FOUND_INSP_TEAM,RESP_INSP_TEAM,RESP_INSP_OPRUNT
17,BIP389,Bpede but bid bprimis ba bmattis borci bin ba bmus bluctus bet.,9-Mar-17,629,,
17,BIP389,Beros beu ba.,9-Mar-17,629,,
17,YWI795,Bnisi bad.,9-Mar-17,409,,
17,YWI795,Bpede bmi beu ba ba ba beu bcum.,9-Mar-17,409,,
17,KNR831,Bcras bad bquisque ba bvel biaculis.,9-Mar-17,513,,
17,BIP389,Bnisl bet bdiam bdonec bdis barcu ba ba bhac bodio ba ba bid ba.,9-Mar-17,629,,
17,SYV137,Bnibh bat ba bsit ba belit ba.,9-Mar-17,513,,
17,EBL860,Borci bad ba bultrices.,9-Mar-17,507,481,400
17,JBC439,Burna bve ba bsed but ba ba ba ba.,9-Mar-17,509,,
17,EBL860,Bpede bin bsodales bamet ba ba ba bve bdis bmi.,9-Mar-17,507,,
17,KNR831,Belit but ba bet ba ba bimperdiet.,9-Mar-17,509,,
17,TRJ645,Bquis bac ba ba bvestibulum borci.,9-Mar-17,413,,
17,DJZ516,Bante beu ba bdui bnetus.,9-Mar-17,409,,
17,EBL860,Bquam bad ba ba bvestibulum bquam bneque.,9-Mar-17,507,,
17,EBL860,Belit bid ba ba.,9-Mar-17,507,,
17,EBL860,Bnibh bet.,9-Mar-17,507,,
17,KNR831,Bodio bmi beu bsit bcommodo but bduis but.,9-Mar-17,513,,
17,EBL860,Bcras bad ba beu bper bac bdiam bcursus.,9-Mar-17,507,,
17,EVB234,Bcras bmi ba blibero beu ba bid.,9-Mar-17,409,,
17,LGO801,Bnisi but.,9-Mar-17,511,,
17,EBL860,Beros bin ba burna ba bhac ba bcum bac barcu ba ba.,9-Mar-17,507,,
17,EVB234,Bante but ba bsem ba ba but.,9-Mar-17,409,,
17,FMU279,Bdiam bmi ba beu ba beros ba ba.,9-Mar-17,629,,
17,FHU982,Borci bve ba ba beu ba bamet.,9-Mar-17,509,,
17,LGO801,Borci bac ba beni ba ba bmauris ba ba.,9-Mar-17,511,,
17,EVB234,Bnisl bve ba.,9-Mar-17,409,,
17,FHU982,Bpede bin ba ba ba ba bcursus ba ba brhoncus ba bturpis bve.,9-Mar-17,509,,
17,VFR160,Bnibh bac ba bet ba beni bdonec.,9-Mar-17,515,,
17,EVB234,Barcu but.,9-Mar-17,409,,
17,VFR160,Bcras bet bid bpurus.,9-Mar-17,515,,
17,FMU279,Borci bad ba ba ba but bin bquam.,9-Mar-17,629,,
17,EVB234,Bnisi bve ba bmus ba bin bdictum ba ba.,9-Mar-17,409,,
17,EVB234,Bnisl bac bmi ba ba bdui ba bmus.,9-Mar-17,409,,
17,VFR160,Bnisl bat.,9-Mar-17,515,,
17,GJK683,Bcras bet ba bturpis bmollis bconsectetuer ba bac bmattis bultrices bcongue ba.,9-Mar-17,409,,
17,VFR160,Bamet beu ba brutrum bet bplatea ba.,9-Mar-17,515,,
17,FMU279,Bcras bet but ba ba bet.,9-Mar-17,629,,
17,VFR160,Bquis bve bdiam bpede ba ba ba bid ba ba ba bin.,9-Mar-17,515,,
17,SYV137,Belit bet ba.,9-Mar-17,513,209,200
17,SPF970,Borci bin bac bnulla.,9-Mar-17,409,,
17,HMS840,Bquis bid ba ba.,9-Mar-17,205,101,100
17,KFN372,Bdiam bat ba bmollis bmorbi ba bultrices.,9-Mar-17,507,,
17,VFR160,Borci beu ba bmi bmus.,9-Mar-17,515,,
17,KFN372,Bnunc bin ba ba ba ba.,9-Mar-17,507,349,300
17,FMU279,Bcras bmi bet ba ba bve bid bnulla.,9-Mar-17,629,,
17,KFN372,Bamet bad ba ba bad bquis but ba bvel bquam bcum ba bhendrerit ba.,9-Mar-17,507,,
17,LGO801,Bnibh but bad but ba.,9-Mar-17,511,,
17,KFN372,Beros bmi ba bid blibero bquam bdignissim.,9-Mar-17,507,,
17,TRJ645,Berat beu ba ba ba biaculis brutrum bad ba bvel bvitae bsagittis.,9-Mar-17,209,,
17,SPA495,Bamet but ba ba but bleo.,9-Mar-17,629,,
17,KFN372,Bquam bad ba ba bet bvel bmi ba bsociis.,9-Mar-17,507,,
17,FMU279,Bnibh bad ba benim ba.,9-Mar-17,629,,
17,FTI824,Bnunc bid.,9-Mar-17,513,,
17,AHN391,Barcu but ba bper bmus bporta ba ba bin bluctus ba.,9-Mar-17,509,,
17,AHN391,Bnisi bat ba ba ba beu.,9-Mar-17,509,,
17,TRJ645,Bpede bac bat ba bbibendum ba bsem.,9-Mar-17,209,,
17,QRM025,Bquis bac ba bdui beni ba.,9-Mar-17,409,,
17,AHN391,Bduis beu bad bac bat beros bmollis ba bve ba bturpis ba.,9-Mar-17,509,,
17,QRM025,Bnisi bet ba binceptos bquis bmi ba blectus baliquet ba bve.,9-Mar-17,409,,
17,FTI824,Bpede bat ba benim ba ba ba bparturient bante.,9-Mar-17,513,,
17,AHN391,Bdiam bmi ba bve bhac bnatoque.,9-Mar-17,509,,
17,MPE786,Belit bet ba ba bnec bquam ba ba ba.,9-Mar-17,629,,
17,FTI824,Beros bet beu ba baptent bpurus.,9-Mar-17,513,209,200
17,GDR742,Beros bmi.,9-Mar-17,607,,
17,NHZ581,Burna bve.,9-Mar-17,413,,
17,FMU279,Berat but ba bad burna bsem ba ba ba.,9-Mar-17,629,,
17,NHZ581,Bante beu bet blacus ba ba.,9-Mar-17,413,,
17,NHZ581,Bnibh but.,9-Mar-17,413,,
17,OWH831,Benim bve.,9-Mar-17,517,,
17,FMU279,Bnisi bac ba ba bipsum.,9-Mar-17,629,,
17,MPO083,Burna bad.,9-Mar-17,507,,
17,VCM016,Bnunc beu ba.,9-Mar-17,511,,
17,MPO083,Bnunc bac ba borci beu ba bnon.,9-Mar-17,507,,
17,RHX208,Bquis bmi.,9-Mar-17,607,,
17,VCM016,Bante bve.,9-Mar-17,511,,
17,JBC439,Bodio bac ba ba bnetus bmi.,9-Mar-17,517,509,500
17,VCM016,Bnisi but ba bmus btempor bclass bad bsociis ba ba ba bnisi ba.,9-Mar-17,511,,
17,RHX208,Bodio bat ba ba ba bporttitor ba.,9-Mar-17,607,,
17,AYO527,Beget bid.,9-Mar-17,515,,
17,RHX208,Beget beu ba bac borci.,9-Mar-17,607,,
17,ZIQ738,Bdiam but ba bnunc ba bprimis bat ba bmalesuada bhac bin.,9-Mar-17,629,,
17,JBC439,Bdiam bad ba bid bante bamet bnon.,9-Mar-17,517,509,500
17,RHX208,Bnunc bid ba ba.,9-Mar-17,607,,
17,YCU023,Bquis bid ba ba bduis bclass best beni ba bpulvinar.,9-Mar-17,409,,
17,RHX208,Belit bat ba brisus ba berat ba.,9-Mar-17,607,,
17,YCU023,Belit bet bve ba bve bet.,9-Mar-17,409,,
17,JBC439,Burna bid ba bplatea.,9-Mar-17,517,,
17,RHX208,Bquam bac ba bmi bin bat ba ba bmi bleo bprimis beu.,9-Mar-17,607,,
17,YCU023,Bpede bet ba bcubilia bquisque ba bvarius burna bac.,9-Mar-17,409,,
17,RHX208,Bquis bid ba bmollis beni bat ba bmi bnec.,9-Mar-17,607,,
17,JBC439,Bnibh bad ba bpretium bnonummy ba bsollicitudin bquis bcum ba.,9-Mar-17,517,,
17,YZU059,Belit bet ba ba bquam ba bnec.,9-Mar-17,413,,
17,YZU059,Bquis bve.,9-Mar-17,413,,
17,DPH631,Bodio bid ba bcum bclass ba borci.,9-Mar-17,509,,
17,DPH631,Bpede bve ba bcras ba bat ba bluctus.,9-Mar-17,509,,
17,JBC439,Bante beu ba.,9-Mar-17,629,,
17,DPH631,Bcras bve ba bin ba bmassa bnullam.,9-Mar-17,509,,
17,DPH631,Bnibh but.,9-Mar-17,509,,
17,QLV652,Bduis bmi ba bquam beu ba.,9-Mar-17,409,,
17,GSF615,Bduis bac ba bat.,9-Mar-17,629,,
17,GSF615,Belit bin ba berat ba bve.,9-Mar-17,629,,
17,GDR742,Bquam bid.,9-Mar-17,607,,
17,THO850,Bduis bin.,9-Mar-17,629,,
17,THO850,Benim but bid ba but barcu ba ba.,9-Mar-17,629,205,200
17,THO850,Bnunc but bet ba bet ba bnam bclass ba.,9-Mar-17,629,,
17,THO850,Beget bmi ba bin ba bpede bnam ba.,9-Mar-17,629,,
17,THO850,Beros bat ba.,9-Mar-17,629,,
17,THO850,Bpede bin ba.,9-Mar-17,629,,
17,THO850,Bamet bad ba ba ba bin bluctus bmassa best bet ba ba.,9-Mar-17,629,,
17,NHZ581,Berat bat ba bhac ba.,9-Mar-17,209,,
17,UWT728,Barcu bat.,9-Mar-17,629,,
17,UWT728,Belit bat ba bat bmauris ba ba bfames.,9-Mar-17,629,,
17,DPH631,Bpede bac bad ba.,9-Mar-17,509,,
17,UWT728,Bante but.,9-Mar-17,629,,
17,UWT728,Bduis bet but bve ba bamet ba ba.,9-Mar-17,629,,
17,UWT728,Bquis bat bid bat ba bdiam bmollis.,9-Mar-17,629,,
17,NHZ581,Bamet bin ba ba bper ba burna benim blibero ba.,9-Mar-17,209,,
17,UWT728,Bante bin bve bnec bac bquam ba.,9-Mar-17,629,,
17,ZIR953,Beget bve bad bmus ba bdolor bdui bamet ba ba ba bfelis ba bvestibulum beu.,9-Mar-17,107,,
17,MPO083,Bduis bmi.,9-Mar-17,507,,
17,YXF326,Bante bac bin bmattis bsit bfeugiat bac ba bmassa.,9-Mar-17,205,101,100
17,MPO083,Bnunc bve bnisl ba bper blacus bcursus ba.,9-Mar-17,507,,
17,FMU279,Bnisi bin but.,9-Mar-17,629,,
17,APZ612,Bquis bin.,9-Mar-17,209,,
17,FMU279,Bnisi bmi bac bleo ba bnon.,9-Mar-17,629,,
17,APZ612,Bduis but bmi bvarius ba ba ba ba.,9-Mar-17,209,,
17,ZVI392,Bquis bin ba ba bodio bet ba bphasellus beni bid bblandit binterdum bhac ba.,9-Mar-17,515,,
17,ADQ781,Bquis beu bad btorquent bclass ba ba.,9-Mar-17,409,,
17,ZVI392,Bquis but ba bcum bnisi ba ba bleo bmus bsapien bsed bpotenti but ba bve bcras ba.,9-Mar-17,515,,
17,IOU412,Bamet bin.,9-Mar-17,511,,
17,ADQ781,Borci beu ba bdis ba bin ba bmassa bconsectetuer burna blibero.,9-Mar-17,409,,
17,IOU412,Borci beu ba bad bet bnibh bcum ba bnonummy ba.,9-Mar-17,511,,
17,ZVI392,Bodio bin bblandit ba.,9-Mar-17,515,,
17,ADQ781,Bpede bmi ba baptent.,9-Mar-17,409,,
17,EPR018,Bodio bmi ba bante bmauris bproin bin.,9-Mar-17,409,,
17,IXT460,Bnisl bad ba beget ba.,9-Mar-17,205,101,100
17,LER634,Bodio bac ba bnunc ba bmorbi bdapibus bsed.,9-Mar-17,509,,
17,IXT460,Beros bin ba.,9-Mar-17,205,,
17,LER634,Beget bve bid ba beget ba ba ba.,9-Mar-17,509,,
17,ALE837,Bcras bad.,9-Mar-17,513,,
17,ALE837,Barcu bat bac ba ba.,9-Mar-17,513,,
17,EQD264,Beget bet ba bmi ba bpede ba bpede ba.,9-Mar-17,409,,
17,DPH631,Bodio bat beget ba blibero bfacilisis biaculis ba bsed bplatea bat brisus bid ba bid.,9-Mar-17,509,,
17,WYP854,Bodio bac ba beu ba bve bat.,9-Mar-17,107,,
17,ALE837,Bante but beget bat.,9-Mar-17,513,,
17,WYP854,Bcras bat bad bmi bsit bneque.,9-Mar-17,107,,
17,ALE837,Benim but.,9-Mar-17,513,,
17,APZ612,Bodio bid beu bmus begestas.,9-Mar-17,209,,
17,LTV094,Berat beu.,9-Mar-17,629,,
17,PVZ436,Beget bat ba.,9-Mar-17,629,,
17,APZ612,Bquis but bet bturpis bnisl bet ba.,9-Mar-17,413,,
17,LTV094,Bdiam bat ba bdolor ba ba blacus ba bmi bfacilisis.,9-Mar-17,629,,
17,APZ612,Benim bet ba.,9-Mar-17,413,,
17,SPI314,Bquis beu ba bac bvitae ba ba ba bquam bcum ba bneque bnisl bnunc.,9-Mar-17,507,,
17,SPI314,Barcu bve ba but ba bduis ba ba ba.,9-Mar-17,507,,
17,WYP854,Beget but ba baccumsan ba best bdui bat.,9-Mar-17,107,,
17,ALE837,Beget bac bet benim bper best bin ba ba.,9-Mar-17,513,,
17,KNR831,Bnisl beu ba bdui bsem bcras ba ba ba bmagnis ba.,9-Mar-17,517,,
17,YCR723,Bduis bac ba ba ba ba but ba.,9-Mar-17,511,,
17,LER634,Bquam bid ba bjusto bmi bligula bnulla.,9-Mar-17,509,,
17,YCR723,Benim bac ba.,9-Mar-17,511,,
17,LER634,Berat bin.,9-Mar-17,509,,
17,YCR723,Bnisi bat.,9-Mar-17,511,,
17,WYP854,Bquis bad ba bhac.,9-Mar-17,107,,
17,RAI572,Bnunc bat bin ba benim ba ba blectus bat ba.,9-Mar-17,629,,
17,SPI314,Bdiam bin borci bmi.,9-Mar-17,507,,
17,RAI572,Belit bve ba bnec.,9-Mar-17,629,,
17,YCR723,Bnibh bet ba ba.,9-Mar-17,511,,
17,RAI572,Bnisi bet bve bmus ba ba blorem ba bfusce ba bduis bsem bhac bquis bdiam bvel bid.,9-Mar-17,629,,
17,LER634,Bduis bat ba bduis bnon ba bat ba bac btortor ba bcursus ba baccumsan.,9-Mar-17,509,,400
17,RAI572,Belit bid.,9-Mar-17,629,,
17,RAI572,Belit bac.,9-Mar-17,629,,
17,RAI572,Bcras bin bat bsem.,9-Mar-17,629,,
17,SPI314,Beget but bet bvelit bcongue ba ba bvel bmontes ba blitora bcongue ba bluctus.,9-Mar-17,507,,
17,HMS840,Benim bad ba bet ba.,9-Mar-17,409,,
17,YWI795,Bnisl beu ba bcum bad bquisque ba bnam ba bnibh bsed beu.,9-Mar-17,413,,
17,HMS840,Bpede beu ba bnon.,9-Mar-17,409,,
17,HMS840,Bnibh bad but burna bdis ba bsed bjusto brisus ba ba.,9-Mar-17,409,,
17,DJZ516,Bnisi bad beu ba bin ba bmorbi.,9-Mar-17,205,,
17,AGU058,Bquis bmi.,9-Mar-17,509,,
17,YWI795,Barcu bve biaculis bvolutpat bmus ba best ba.,9-Mar-17,413,,
17,SYV137,Bnibh bmi bid bnec bleo.,9-Mar-17,517,,
17,YWI795,Benim but bid bsem bhac but baliquet bcras ba.,9-Mar-17,209,,
17,VCM016,Bnibh bmi bquam.,9-Mar-17,515,,
17,ALE837,Bnunc bmi.,9-Mar-17,513,,
17,SEK173,Bnunc bet.,9-Mar-17,507,,
17,SPF970,Bpede bad ba ba ba ba ba bvel bid.,9-Mar-17,205,101,100
17,RBT219,Bnisi bet ba burna btortor ba bmolestie ba.,9-Mar-17,409,,
17,AGU058,Bnunc bmi ba bdolor ba bdis bac.,9-Mar-17,509,,
17,RBT219,Bnisl bmi bac ba ba ba bhabitasse ba bmi.,9-Mar-17,409,,
17,AGU058,Bamet bad ba btellus bat baenean ba beu blitora betiam bper bhac beu bdiam.,9-Mar-17,509,,
17,YCU023,Bdiam bet ba bleo ba ba ba bsemper bdis beu blobortis bnetus ba.,9-Mar-17,209,,
17,EVB234,Beros beu bnatoque brisus bmi bve.,9-Mar-17,413,,
17,SEK173,Berat bmi bet bsemper bvel ba bvolutpat bduis ba bipsum.,9-Mar-17,507,,
17,EVB234,Bamet bet.,9-Mar-17,413,,
17,SEK173,Bduis bmi ba bet btortor bnam bproin.,9-Mar-17,507,,
17,EBL860,Bcras beu ba bve belit ba ba ba.,9-Mar-17,511,,
17,QZH295,Belit bve beros ba ba bpretium ba beu ba bin bat bhac.,9-Mar-17,509,,
17,YAP829,Bnisi bmi ba bat bvel.,9-Mar-17,629,,
17,QZH295,Bnibh bve.,9-Mar-17,509,,400
17,IOU412,Bnisl beu ba ba btristique bodio beu ba.,9-Mar-17,515,,
17,KUR214,Borci bid bcubilia bdonec bad.,9-Mar-17,409,,
17,EBL860,Bquam bmi ba ba bve bante ba bnatoque beni ba.,9-Mar-17,511,,
17,ICB356,Bodio bmi.,9-Mar-17,517,507,500
17,ICB356,Bcras bin but ba ba ba ba ba.,9-Mar-17,517,,
17,YXF326,Bquis bat ba ba ba ba ba.,9-Mar-17,409,,
17,YXF326,Belit but ba bnetus ba bsollicitudin.,9-Mar-17,409,,
17,BIP389,Bduis bid ba beu bdui bdis bmi bmetus but.,9-Mar-17,607,,
17,PVZ436,Bodio bad ba bid bdiam baenean ba ba bdiam bvelit bmi.,9-Mar-17,517,503,500
17,BIP389,Beget bet beros bet bnisl.,9-Mar-17,607,,
17,PVZ436,Bquis but.,9-Mar-17,517,,
17,BIP389,Bnunc bad bin.,9-Mar-17,607,,
17,TRJ645,Bnunc bin.,9-Mar-17,507,,
17,BIP389,Borci bac.,9-Mar-17,607,,
17,DPL397,Berat bat ba ba bdiam bfelis bmi ba ba bdolor begestas bnam ba ba.,9-Mar-17,629,,
17,QLV652,Bquis bin ba.,9-Mar-17,209,,
17,DPL397,Benim bad.,9-Mar-17,629,,
17,ARS065,Bpede but bodio.,9-Mar-17,629,,
17,QZH295,Bodio bac.,9-Mar-17,509,,
17,PVZ436,Bnunc bid ba bin bsit bcum blacus bvitae beu ba beu bsed bnec beu bleo.,9-Mar-17,517,501,500
17,DPL397,Barcu bad ba ba bleo ba ba bnon ba bamet.,9-Mar-17,629,,
17,ARS065,Barcu but ba bad but.,9-Mar-17,629,,
17,QZH295,Bnisi bid ba bcursus bmus bmi beuismod ba blectus beni.,9-Mar-17,509,,
17,QLV652,Bante but ba ba ba.,9-Mar-17,209,,
17,ARS065,Bquis but.,9-Mar-17,629,,
17,JYZ708,Berat beu bid bsenectus ba bnam blorem ba ba ba biaculis ba bve.,9-Mar-17,409,,
17,QZH295,Bnunc bad.,9-Mar-17,509,,
17,QZH295,Bodio beu ba ba ba.,9-Mar-17,509,,
17,ILA012,Bnibh bet ba blitora bsapien ba ba.,9-Mar-17,409,,
17,QLV652,Bduis bad beu bneque bac bconsequat bvelit bve.,9-Mar-17,209,,
17,EBL860,Burna bin but ba beget ba bin beni.,9-Mar-17,511,,
17,QLV652,Bnibh bad bac bpulvinar bnulla btaciti beni.,9-Mar-17,209,,
17,ARS065,Bante bid.,9-Mar-17,629,203,200
17,QZH295,Bamet bve bat bprimis bplatea bfeugiat ba bve but bper.,9-Mar-17,509,,
17,QZH295,Bnunc bmi ba ba barcu ba bmorbi bper ba bvolutpat bnunc bet ba bnam borci.,9-Mar-17,509,,
17,YLV153,Beget bet beu.,9-Mar-17,107,,
17,QZH295,Beros bet beu bac bleo ba bcum ba ba ba bcum brutrum btaciti.,9-Mar-17,509,,
17,AHN391,Berat bet.,9-Mar-17,513,,
17,QZH295,Bquam but bamet bquam ba bad bsit ba ba.,9-Mar-17,509,,
17,DZV145,Borci bve bin bac ba ba ba beni ba ba bturpis ba borci ba.,9-Mar-17,607,,
17,LED479,Bnisl bve ba bdonec bid ba bve bauctor bfelis.,9-Mar-17,629,,
17,LED479,Bante bve.,9-Mar-17,629,,
17,GFM783,Bquam bid benim bnam ba bve.,9-Mar-17,607,,
17,YCR723,Bnunc beu bid bante ba bnec ba ba.,9-Mar-17,515,,
17,PJL425,Beros bat.,9-Mar-17,517,,
17,QLV652,Bnisl bin ba bfames bamet ba ba bmontes.,9-Mar-17,209,,
17,AHN391,Bamet bid bconubia bpraesent bdui ba ba blitora ba ba bsodales bsed ba bproin ba.,9-Mar-17,209,,
17,QLV652,Bnisl bmi beu bnibh bnunc bullamcorper bmontes bat.,9-Mar-17,413,,
17,IXT460,Bnunc but ba ba.,9-Mar-17,409,,
17,QLV652,Bnibh bac ba bsociis bsemper but ba bsapien ba.,9-Mar-17,413,,
17,ARS065,Borci beu but blobortis.,9-Mar-17,629,,
17,IXT460,Burna but ba bquam.,9-Mar-17,409,,
17,QLV652,Borci but beget bporta bsollicitudin bnisi bper ba bquis bpurus bpellentesque burna bsed ba bvivamus.,9-Mar-17,209,,
17,SYA283,Beros bmi bet bmassa.,9-Mar-17,517,,
17,KFN372,Bnunc bat.,9-Mar-17,511,,
17,NHZ581,Bquam bac ba ba bcum ba ba ba ba ba bpenatibus bsed.,9-Mar-17,507,479,400
17,EPR018,Bcras but.,9-Mar-17,205,101,100
17,AHN391,Benim bad bodio bante ba ba baenean.,9-Mar-17,513,,
17,AHN391,Bquis beu ba ba ba ba bproin ba bparturient.,9-Mar-17,513,,
17,CSV482,Bnibh bmi ba blectus ba ba bhabitasse.,9-Mar-17,509,,
17,NHZ581,Bnibh bet but baccumsan ba bhac beget ba ba belementum bdis bin bante ba ba ba ba.,9-Mar-17,507,479,400
17,NHZ581,Bdiam bac ba bornare bpede best but bnam bcursus.,9-Mar-17,507,,
17,NHZ581,Bnisl beu but bnec ba bdui bcondimentum ba bac burna bmagna bsem.,9-Mar-17,507,,
17,KFN372,Borci bmi.,9-Mar-17,209,,
17,NHZ581,Beget bet binteger.,9-Mar-17,507,,
17,ZKY831,Burna bat ba ba bsed.,9-Mar-17,517,,
17,DPH631,Bquis bmi.,9-Mar-17,513,,
17,NHZ581,Bante bmi ba ba bleo ba ba ba bquis ba.,9-Mar-17,507,,
17,AYO527,Barcu bad ba ba bmi ba.,9-Mar-17,517,507,500
17,NHZ581,Bnibh bac.,9-Mar-17,507,,
17,NHZ581,Burna bid ba bvitae burna ba ba bneque ba ba bmetus ba ba ba bsem bid.,9-Mar-17,507,,
17,GJK683,Borci bmi ba.,9-Mar-17,209,,
17,NHZ581,Bdiam but bad bdonec beuismod.,9-Mar-17,507,,
17,MPO083,Barcu bad ba ba ba bmagnis bfermentum bvivamus ba bin ba ba bante bmassa.,9-Mar-17,511,,
17,EQD264,Bquam but beu best bad bdolor.,9-Mar-17,209,,
17,SPF970,Borci bin ba bper blitora ba bleo.,9-Mar-17,409,,
17,ALE837,Bnunc bad.,9-Mar-17,517,,
17,SPF970,Bquam bad bve but bdis bjusto brhoncus bnec bfames.,9-Mar-17,409,,
17,MPO083,Beros bad barcu burna ba ba bsit bnisl bquis ba ba bet.,9-Mar-17,511,,
17,MPO083,Bnibh bad ba ba bin.,9-Mar-17,511,,
17,ALE837,Burna bac.,9-Mar-17,517,,
17,HMS840,Bodio bat ba bcum ba bmassa ba ba ba.,9-Mar-17,209,,
17,ALE837,Bnisl bac ba ba bac but bfelis bconubia bcum ba bposuere.,9-Mar-17,517,,
17,DPH631,Bcras bin ba bnec bdonec bsodales btempor binceptos bid bcongue.,9-Mar-17,513,,
17,ALE837,Borci bet.,9-Mar-17,517,,
17,LER634,Bnibh bmi bac ba bsit ba.,9-Mar-17,513,,
17,MPO083,Bamet bet.,9-Mar-17,511,,
17,LER634,Belit bid bmi.,9-Mar-17,513,,
17,KNR831,Beros bad.,9-Mar-17,629,,
17,LGO801,Beros bin ba bquam ba ba bligula bdui.,9-Mar-17,629,,
17,APZ612,Berat bad ba bac bvitae.,9-Mar-17,509,,
17,APZ612,Bquam bat bet bac bper brisus ba bporta bquisque bornare ba.,9-Mar-17,509,,
17,JYZ708,Beros bet blacinia ba bve.,9-Mar-17,409,,
17,APZ612,Bquam bad ba ba bin belit bauctor bipsum ba ba ba bmontes.,9-Mar-17,509,,
17,APZ612,Bnisl bin ba ba bcum ba bmagna ba bneque.,9-Mar-17,509,,
17,FTI653,Berat bat ba burna ba ba bquis ba brutrum bat ba.,9-Mar-17,205,101,100
17,HMS840,Berat bet.,9-Mar-17,209,,
17,XRO730,Bcras but bid bquam burna.,9-Mar-17,107,,
17,FZA809,Bante bad ba ba bnisl beu ba bclass.,9-Mar-17,507,,
17,XRO730,Benim bet bid bduis bsem ba ba bfringilla binteger ba beni ba bsapien.,9-Mar-17,107,,
17,RBT219,Bnisl bmi bac ba bamet bet bin.,9-Mar-17,209,,
17,MAU864,Beget bet ba benim bante ba but bat bnon bat.,9-Mar-17,409,,
17,EBL860,Beget bin ba ba ba btortor.,9-Mar-17,515,,
17,MPO083,Bnibh beu.,9-Mar-17,209,,
17,RBT219,Benim bmi ba blitora.,9-Mar-17,413,,
17,FHU982,Bduis bmi bnisl ba ba bnostra bcongue bsollicitudin ba.,9-Mar-17,517,,
17,XRO730,Bnunc bet ba ba bmalesuada ba bac bphasellus bauctor bnon bluctus.,9-Mar-17,107,,
17,SPI314,Bduis bet bblandit bsagittis bnon ba bet ba blibero bin brutrum.,9-Mar-17,511,,
17,AGU058,Bpede bin ba ba bquam ba.,9-Mar-17,513,,
17,XRO730,Beget bac ba ba bluctus bat ba bin bet bmagna bmi ba bprimis.,9-Mar-17,107,,
17,ZVI392,Barcu bat ba bornare bac ba bporta ba bhymenaeos ba.,9-Mar-17,517,,
17,KUR214,Bnisl but ba bid ba ba.,9-Mar-17,205,101,100
17,XRO730,Belit bat bnisi bmus.,9-Mar-17,107,,
17,SPI314,Bnunc but ba ba btincidunt.,9-Mar-17,511,,
17,AGU058,Bnibh bin ba bin bsed bve ba ba bvel barcu.,9-Mar-17,513,,
17,KNR831,Belit bac.,9-Mar-17,517,,
17,AGU058,Bquis beu ba bat ba best ba bpretium beni.,9-Mar-17,513,209,200
17,XRO730,Bduis beu ba ba best benim ba ba.,9-Mar-17,107,,
17,KNR831,Bnisl bve ba bcum bsed ba.,9-Mar-17,517,,
17,LGO801,Bdiam but ba ba ba bmauris bconsequat ba bmollis.,9-Mar-17,517,507,500
17,SPI314,Bnisi bmi ba bnulla bnetus bat beget beu.,9-Mar-17,511,,
17,FTI653,Burna bat bnisl btaciti ba binceptos bconsectetuer bdiam ba ba bhendrerit bquam.,9-Mar-17,409,,
17,LGO801,Bquis bet ba bve.,9-Mar-17,517,503,500
17,MPE786,Bnisl bid ba bdui baenean ba ba ba.,9-Mar-17,629,,
17,AGU058,Bnisi bac.,9-Mar-17,513,,
17,VCM016,Beros bve.,9-Mar-17,629,,
17,MPE786,Bcras bid ba binterdum ba bnam betiam.,9-Mar-17,629,,
17,SYV137,Beget bve ba bnam brhoncus bcurabitur beget bmi bin bjusto ba.,9-Mar-17,517,505,500
17,VFX591,Benim bac bad bhabitant ba ba bnibh ba ba bat belit ba.,9-Mar-17,409,,
17,AGU058,Bante bet ba ba bsit burna beget.,9-Mar-17,513,,
17,MPE786,Bodio beu benim ba baugue bvelit ba bve ba beu ba ba bluctus.,9-Mar-17,629,,
17,VFX591,Bquam bet bat bsuscipit ba best beros benim bullamcorper bplatea.,9-Mar-17,409,,
17,KBY534,Bodio bet bmi bmagnis bnibh bin.,9-Mar-17,107,,
17,VFX591,Beget bin ba best beni ba binteger bpotenti ba bnec ba beget ba bvelit.,9-Mar-17,409,,
17,KNR831,Bamet bve bid bin bdui.,9-Mar-17,517,,
17,YWI795,Borci bve ba bfringilla bper ba.,9-Mar-17,509,,400
17,ZPW452,Barcu bac.,9-Mar-17,507,,
17,SPI314,Bodio bat ba blibero bpulvinar blectus.,9-Mar-17,209,,
17,SPI314,Bante bet.,9-Mar-17,209,,
17,GSF615,Bpede bin bdapibus bpraesent best ba ba ba bhabitasse bhac ba bmagna bpede.,9-Mar-17,629,,
17,EPR018,Barcu bmi bin bsem.,9-Mar-17,409,,
17,SEK173,Bante bat ba ba beni bfames ba.,9-Mar-17,511,,
17,AGU058,Beget bve ba bamet ba ba bad bplatea bnullam bgravida ba.,9-Mar-17,513,209,200
17,EPR018,Berat bat bac best bpulvinar bve bnon bad bmorbi blacinia bnam bac ba bquam bcongue bcurae.,9-Mar-17,409,,
17,YKN950,Bnisl bad ba bsem bmagna beuismod bnec ba bnunc ba ba bligula.,9-Mar-17,413,,
17,FQP941,Bdiam bin.,9-Mar-17,205,101,100
17,EZQ530,Berat bad brhoncus bquis ba bvitae bac bnibh bnisi ba bmagna bauctor ba bvarius.,9-Mar-17,517,,
17,EPR018,Bodio bac ba bin bluctus ba ba ba ba.,9-Mar-17,409,,
17,EZQ530,Borci bet ba btortor bhac ba beni btellus.,9-Mar-17,517,,
17,QDR380,Bquam bmi ba ba ba bporta ba.,9-Mar-17,629,,
17,QZH295,Bdiam bet ba ba.,9-Mar-17,513,,
17,YWI795,Bodio bet ba bquam.,9-Mar-17,509,,
17,QZH295,Bduis bmi.,9-Mar-17,513,,
17,QZH295,Bnunc bad.,9-Mar-17,513,,
17,XSZ543,Bamet bin bmi ba bnisi ba bnec benim ba bodio ba bfames bvitae bin.,9-Mar-17,409,,
17,SEK173,Bante bid.,9-Mar-17,511,,
17,YBJ023,Bquis bat ba bpretium bhac.,9-Mar-17,629,,
17,MPO083,Bpede bad bat bet ba ba ba ba bet.,9-Mar-17,515,,
17,YBJ023,Bquam bid ba bsem bid baliquam bpurus ba bnisl.,9-Mar-17,629,,
17,YBJ023,Benim bmi bat.,9-Mar-17,629,,
17,MPO083,Borci bve bat bvelit ba bquam ba ba ba ba but ba bsit bad beu ba bposuere.,9-Mar-17,515,,
17,YBJ023,Bnibh bmi ba beuismod ba betiam.,9-Mar-17,629,,
17,EZQ530,Bnisi beu bmi bin bdui bvelit ba bcras ba.,9-Mar-17,517,,
17,YBJ023,Bante beu.,9-Mar-17,629,,
17,YBJ023,Bpede bid.,9-Mar-17,629,,
17,XSZ543,Belit bmi bve bleo bfacilisi bid bcum.,9-Mar-17,409,,
17,DJZ516,Borci bid ba bdui ba bsem blectus bmi ba ba bnonummy bligula bve ba bcum.,9-Mar-17,209,,
17,YWI795,Bante bat bid ba bdolor.,9-Mar-17,509,,
17,IXT460,Bcras bid ba ba.,9-Mar-17,209,,
17,EVB234,Borci bmi bnisl ba.,9-Mar-17,509,,
17,PJL425,Bpede bat.,9-Mar-17,517,,
17,DPA037,Borci beu ba bid ba ba bve bmi ba ba btempus bat.,9-Mar-17,409,,
17,IXT460,Burna bve.,9-Mar-17,209,,
17,DPA037,Bnibh bat bodio ba ba bad ba ba ba ba bimperdiet bconsectetuer bodio.,9-Mar-17,409,,
17,DPA037,Bquis bmi bad best bnam ba bdiam.,9-Mar-17,409,,
17,DPA037,Bquis but bmi bin bet ba.,9-Mar-17,409,,
17,DPA037,Bnisi bat ba bnec bmontes bduis.,9-Mar-17,409,,
17,ICB356,Bcras but.,9-Mar-17,629,,
17,QRM025,Benim bet ba bnon bprimis bat ba bvelit bdui ba ba bmi btaciti ba ba bat.,9-Mar-17,507,,
17,EVB234,Bante bve.,9-Mar-17,509,,
17,QRM025,Borci but ba ba bmus bmorbi baenean ba bve ba ba ba ba.,9-Mar-17,507,,
17,PJL425,Bduis bid ba burna bin bat ba baugue bsollicitudin beros.,9-Mar-17,517,,
17,ICB356,Bamet bmi bgravida beget ba bmetus ba bnetus ba beget best ba.,9-Mar-17,629,,
17,PJL425,Bquis bet ba ba.,9-Mar-17,517,,
17,EVB234,Beros bat ba ba bdiam bjusto barcu belementum bnon.,9-Mar-17,509,,
17,QPC953,Burna bet ba ba bet bdis.,9-Mar-17,629,,
17,EVB234,Burna bin ba bvel ba ba ba bet bmi.,9-Mar-17,509,,
17,DJZ516,Bnisl bac ba bsed ba.,9-Mar-17,413,,
17,QRM025,Burna bve bid bat.,9-Mar-17,507,479,400
17,OQS570,Beget bat ba ba beu bmus bleo beu bsociosqu bjusto.,9-Mar-17,409,,
17,TRJ645,Belit bve beu.,9-Mar-17,511,,
17,QZH295,Bpede bad bet ba ba ba ba bve bligula bnam bconubia bid ba.,9-Mar-17,513,,
17,FTI824,Bpede bid ba ba bnon btaciti.,9-Mar-17,517,,
17,FTI824,Bante bid ba bquis ba.,9-Mar-17,517,,
17,HQI892,Bpede bid ba bbibendum bpede bdictumst.,9-Mar-17,409,,
17,SPF970,Bnibh bat ba bve bhendrerit bneque bin ba bhac.,9-Mar-17,209,,
17,EZQ530,Burna bac.,9-Mar-17,517,,
17,OWH831,Bdiam but bet.,9-Mar-17,629,,
17,EZQ530,Bquis bac ba bnon bnisl bquam ba bleo ba ba ba ba bpenatibus bleo.,9-Mar-17,517,,
17,VCM016,Burna bid ba bnam blibero bcubilia belit ba ba bid bsem.,9-Mar-17,517,507,500
17,EVB234,Bnisi but ba ba ba bneque but ba.,9-Mar-17,509,,
17,DPH631,Belit bat bid bnisi bmauris bnulla bnam bquam ba bin.,9-Mar-17,517,,
17,TRJ645,Bnibh bac ba bnec bnisi ba bdis.,9-Mar-17,511,,
17,ALE837,Bnibh bet bin bve bante ba bnam beni bodio.,9-Mar-17,629,,
17,FTI653,Bcras bin ba bnec ba ba bturpis bvitae beu ba.,9-Mar-17,409,,
17,FTI653,Bcras bac bve ba ba bnisi bmi bquis beu ba.,9-Mar-17,409,,
17,FTI653,Berat beu bamet bper ba ba bnam bid bviverra ba.,9-Mar-17,409,,
17,FTI653,Bquis but.,9-Mar-17,409,,
17,XGC043,Barcu bet ba bve.,9-Mar-17,409,,
17,SPF970,Beros beu ba bdolor btristique beni bat bamet ba ba bmagnis bad ba ba bat beni.,9-Mar-17,413,,
17,YCU023,Beros bat ba bnon bcum ba bvel bsemper bid.,9-Mar-17,507,,
17,YCU023,Bdiam bad ba ba ba bpenatibus bamet bjusto bodio.,9-Mar-17,507,,
17,EVB234,Bpede bet ba bfusce bdis.,9-Mar-17,509,,
17,QBR938,Bnunc bad bquam bnisl ba ba bmassa.,9-Mar-17,607,,
17,SEK173,Bcras bmi ba bdui barcu.,9-Mar-17,515,,
17,QBR938,Belit bat ba ba bsed bpurus bplatea ba ba bet bturpis bante.,9-Mar-17,607,,
17,KUR214,Bamet bac ba ba ba but.,9-Mar-17,409,,
17,QBR938,Berat bet ba bsed.,9-Mar-17,607,,
17,CSV482,Bnunc bmi bat bve best ba bultrices borci bve ba bac ba.,9-Mar-17,513,,
17,QBR938,Bcras but ba bjusto ba bipsum ba ba bquis bve ba.,9-Mar-17,607,,
17,KUR214,Borci but ba bhac bac ba bcum ba.,9-Mar-17,409,,
17,QBR938,Bnisl bad ba ba ba bsapien.,9-Mar-17,607,,
17,QBR938,Bduis beu.,9-Mar-17,607,,
17,QBR938,Borci bad ba.,9-Mar-17,607,,
